empresa,ticker,data_publicacao,fonte,tipo,titulo,url,snippet_ou_trecho,sentimento,tags,severidade,resumo_curto
OceanPact,OPCT3,2026-03-30T23:03:00+00:00,Google News,noticia,Oceanpact (OPCT3) aprova recompra de ações e fusão com CBO Holding - Investidor10,https://news.google.com/rss/articles/CBMirgFBVV95cUxNQk15aTFNdWVwcEFlU0t4S3BocjBYVy0yajd6R2lDS0o5UmptX19EdVR4R2ZYRWo4amFiaXVhY3ZRTnowMXFRN2tFbWNldDFUYUdCb0xmWEw0YlkwcExVOFhOVngteU9BRnZrenBtUE0wQkxoREt6NEl3S1phZS1ZQXpYRFRrQ3dFVWZJYmQ2U2FFMHBqeVdudzRhNDZ1eW5rMUJOWjdDUE1KT2xwQUHSAbMBQVVfeXFMTlpUYmlPS29DMWpHdHl5ai05Sy1SMGRxLVFHY2ljak5nWERTbUFfOXNMUGNQbEE1NmtyLU5ELXVidktHVldFLTVmSDFhbHdfaWFvTmpIR1ptN3l5YTFhRF9GWmQtaENiVmtsYkplNTFJTTV6cy03ZkxGZkpKSzlBVUl5OC1nUU1JOVJDR045MjN6dHVUZ1JhS19wZ3NZcVdtVW82Y2hka2VKTlFDblNCUV8wY1E?oc=5,Oceanpact (OPCT3) aprova recompra de ações e fusão com CBO Holding Investidor10,positivo,m&a_estrategia;governanca,2,Oceanpact (OPCT3) aprova recompra de ações e fusão com CBO Holding. O anúncio envolve duas ações estratégicas: programa de recompra de ações e combinação com a CBO Holding.
OceanPact,OPCT3,2026-03-31T15:41:47+00:00,Google News,noticia,OceanPact (OPCT3) avança em fusão e pode destravar valor no setor offshore - Guia do Investidor,https://news.google.com/rss/articles/CBMiswFBVV95cUxPNzR4dHF0d3BjNXVaSk9MU3dhdkpPNU93TWh3RXpjZEtpVTF2bHRqSUw4dEVYSWozYl9CRWRoeVZIWHBCbm50TFhSQWczRHdaaGNZVG4xYU9ONWpsMGRzdXNlUHBwNEVCd1RxYjVhOHFZX0VWSVNMeE5xcjV0ak02Wlo2SWRJVl9wbTFKMGwtMWxjR2FRM2U3MXdBSnkzSjNjc2ZDTU96dEhGYzhvd05vSEV6Zw?oc=5,OceanPact (OPCT3) avança em fusão e pode destravar valor no setor offshore Guia do Investidor,positivo,m&a_estrategia;setor_macro,2,OceanPact (OPCT3) avança em processo de fusão que pode gerar destrancamento de valor no setor offshore. A notícia aborda progresso em operação estratégica de fusão sem especificar dados quantitativos ou cronograma.
OceanPact,OPCT3,2026-03-30T21:43:00+00:00,Google News,noticia,OceanPact (OPCT3) aprova recompra de até 6 mi de ações ON - Visno Invest,https://news.google.com/rss/articles/CBMimAFBVV95cUxOWDNBdndITng4aWdWMlhibHViV3hQbzV6YlN0RUR4NV9FWmZnWGM3UXJuaktrSGlHNFdJV1d2Rm5FM1gwQ1FhX2ZKUDJBX0lJbEhiQUJvVE5RVkFmUlNIcW5wcVRxY3VheXlkeFhIcjI0cWdiUzcwbHZJZWpockh3ODQ3NkNXal9FRUtaNFppZVJlQlBGMVljUw?oc=5,OceanPact (OPCT3) aprova recompra de até 6 mi de ações ON Visno Invest,positivo,governanca,2,OceanPact aprovou programa de recompra de até 6 milhões de ações ordinárias. A medida visa otimizar a estrutura de capital da companhia.
OceanPact,OPCT3,2026-03-31T13:04:27+00:00,Google News,noticia,OceanPact aprova combinação com CBO e anuncia recompra de ações de até 3% do capital - ADVFN,https://news.google.com/rss/articles/CBMiakFVX3lxTE1XTTNLQUtaRDB1ZU9YUmFZRVBzTmM5NnpMbG81TzhNQ1dudy0zdGFuaGlVaHQwU19rUEEyaVowZ0h4VWE1N2F2cG8tWGhwTExybkpqdFR4a01XRnNhekFrSk00eU52SEh1TlE?oc=5,OceanPact aprova combinação com CBO e anuncia recompra de ações de até 3% do capital ADVFN,positivo,m&a_estrategia;governanca,2,OceanPact aprovou combinação com CBO e anunciou programa de recompra de ações de até 3% do capital. A operação representa movimento estratégico de consolidação e retorno de capital aos acionistas.
OceanPact,OPCT3,2026-03-30T21:23:55+00:00,Google News,noticia,Acionistas da CBO aprovam combinação de negócios Oceanpact - TradingView,https://news.google.com/rss/articles/CBMid0FVX3lxTFA2bHVCX2NGZktGNEwxLS03YmVJaDYzeGMwU3RjXzEwTFROdmZYdll2XzkwZ2h2emdXYnBNMTR1Wld2NmU3ejNXaEotbmZabktfMXVIaHBESlV6Tk5sc1J1RHg2N3FWOWhTMlZRT081Y0stZzlrOTJJ?oc=5,Acionistas da CBO aprovam combinação de negócios Oceanpact TradingView,positivo,m&a_estrategia;governanca,2,Acionistas da CBO aprovaram a combinação de negócios com a Oceanpact. Trata-se de uma operação de fusão/aquisição que recebeu aprovação em assembleia de acionistas.
OceanPact,OPCT3,2026-02-28T08:00:00+00:00,Google News,noticia,"Nova gigante à vista? OceanPact (OPCT3) anuncia fusão com CBO e cria potência de serviços marinhos com R$ 13,6 bilhões em contratos - Seu Dinheiro",https://news.google.com/rss/articles/CBMihAJBVV95cUxPTlpuVVB6SGpmUmkyUy1kLXducFF2WkdIU1R1b2ZOaEt5RTF1ckp3cTFvX0dUWlBYdlBfVjZ2cU9DVkIwVmQ0cER3QWlJcFZzLXhDdkJZYVhuLU5KY2RnUl9ZVE9rUVdNNEMyNGdFT3UzUTRTSzd6ZURmY3R0M0wwQkJtNm5CdGE0Nm9URVFNWnNzZTJubUFlblF3SEZOLVcxbDhoUVgzTzRNN21qaUt6MEY5bHRZLTBYQ21kNzU3b09LUXVKbk9iSUYtbGdFZXRaTlotcWMzOV9oTGxKNjNER0NyazNqbm9BUGc3d3JOT2NUbzFqaEhrN002eGVxSnBaUmJFVw?oc=5,"Nova gigante à vista? OceanPact (OPCT3) anuncia fusão com CBO e cria potência de serviços marinhos com R$ 13,6 bilhões em contratos Seu Dinheiro",positivo,m&a_estrategia;operacional_incidente,2,"OceanPact anuncia fusão com CBO, criando uma potência em serviços marinhos com R$ 13,6 bilhões em contratos acumulados."
OceanPact,OPCT3,2026-03-02T08:00:00+00:00,Google News,noticia,Oceanpact: ação fecha estável apesar de avaliação positiva sobre fusão com CBO - InfoMoney,https://news.google.com/rss/articles/CBMisgFBVV95cUxNSkUzTFJrM0ZIR2VCUWVPSlB4UW1DaXZCTWJTYWF1bnlqd1JzNms1VEV3cW1fb1RtakRRMGZDNmU0TGY2WFZpcEE1WGctN1E5bHJjNUF6aVEzaHF5SU15ejA1OHZiYUExcE8tU01tWGE4S3lCOU13bVNZaGFPeW5YZjdScHVaTE5WQmZDWVM2a0ZzUlQyUGM2WHF2Rm81bDNMUkpTTnIxUnpNMjZhWmVUSnRn0gG3AUFVX3lxTE92UUpiRTdXeGdLeWZJa0U2YS1QUWNpbFdvb3F6VEYycWpTYUowYl9Na0hGQnNrYXRKNlh6TEN3NWxBd1ZiZnVRcU9HZ01rZlA2NzZBaDgwT25oaDkwdTl6VERXLWQ1c2JHSzhULWxBcDhBTzlpMkV4MzNLNmhOb2RYcXNtaWRXcU5Ta1NXWll5MlliUTFDNHJVQTBZQTlUOTg5Q2xzMkJLeHNYR2dVWjl4NjFDeU9OWQ?oc=5,Oceanpact: ação fecha estável apesar de avaliação positiva sobre fusão com CBO InfoMoney,neutro,m&a_estrategia,1,Ação da Oceanpact fechou estável apesar de avaliação positiva sobre fusão com CBO. O mercado não reagiu significativamente à notícia positiva sobre a operação de fusão.
OceanPact,OPCT3,2026-02-27T08:00:00+00:00,Google News,noticia,"OceanPact (OPCT3) anuncia fusão com CBO e cria empresa de apoio marítimo com R$ 13,6 bilhões em contratos - Money Times",https://news.google.com/rss/articles/CBMi0gFBVV95cUxNTEg0NE5qYXZXZk1DX2tYQTA2ZFNhWDdGVUYwam5BdnFLQXdUeWZNNWZBVXNCYmpKMkxlQTRRV2ZqbGxxUEhBLVVuVGs0czEzRWdRNG5Gaml0bnVxeHFFSWo1SWtCZTE1S0JpWmEySnFQSHhWRk1xR1l4Wm9oMHBhZDRJQ3NoMVNGcmJJZ1BvNEM2YXNsNmJvSTUzemJlNWU5RkNKQkg5MVBON0wxT3dLT1B0Y1ZVN0J3cm5naHBFTzcxNXdialQyM1d4V243c05rT3c?oc=5,"OceanPact (OPCT3) anuncia fusão com CBO e cria empresa de apoio marítimo com R$ 13,6 bilhões em contratos Money Times",positivo,m&a_estrategia;operacional_incidente,2,"OceanPact (OPCT3) anuncia fusão com CBO para criar empresa de apoio marítimo com R$ 13,6 bilhões em contratos. A operação representa expansão estratégica no segmento de serviços marítimos."
OceanPact,OPCT3,2026-03-30T21:37:07+00:00,Google News,noticia,OceanPact (OPCT3) aprova combinação de negócios com a CBO Holding - Visno Invest,https://news.google.com/rss/articles/CBMiowFBVV95cUxPV0ktMzFYR2lSQlBCRUVJYUhUZFVfSG01WUh2ZkVmXzV5eWRIYUZDQ3p1cFlIUHFGOExpaHlvTHZ4WThwSXl3STUxR2lhNl90MmpIX0o0Y2YtQUR4OHJyQnJQYkdzaHJUcTlETFNUTHlnTDZmMV9GblE4Zi1pYjN1clZ4VUo2ZjNfX1BpbWdQdjJkemxyWkoydGxqUWRIRFNxUThr?oc=5,OceanPact (OPCT3) aprova combinação de negócios com a CBO Holding Visno Invest,positivo,m&a_estrategia,2,OceanPact (OPCT3) aprovou uma combinação de negócios com a CBO Holding. O anúncio indica movimento estratégico de fusão ou integração entre as duas empresas.
OceanPact,OPCT3,2026-03-02T08:00:00+00:00,Google News,noticia,Fusão entre OceanPact e CBO deve elevar dividendos a acionistas - EuQueroInvestir,https://news.google.com/rss/articles/CBMingFBVV95cUxNZkxCNkZ2ZjZHQUxZMEhaWXJpWm5EbGRzVnNDUVJZeGpYVlFGdmlPWlNDSU9JdHcyYjNINDlna2Fkand5ODk5ZlEtdVlLMzJsdkxPdGVzMzhnUDBtOEtKUmZtSGYtMUhidjdkTG5jU0g3MnY2Vnhua3dmckhLZkVKelRSWlI2UmhmOXpUNkNZZUVrRm1LLVQxTzNLck55dw?oc=5,Fusão entre OceanPact e CBO deve elevar dividendos a acionistas EuQueroInvestir,positivo,m&a_estrategia,2,OceanPact e CBO anunciam fusão com perspectiva de elevação de dividendos aos acionistas. A operação busca criar sinergias que beneficiem a remuneração dos investidores.
OceanPact,OPCT3,2026-03-05T08:00:00+00:00,Google News,noticia,OceanPact (OPCT3): surgiu um tsunami de oportunidades? - Acionista.com.br,https://news.google.com/rss/articles/CBMiggFBVV95cUxNVWp3TzJJRFhjX0d5TF9qNDZwX2Y2VDRlR1RBUnJXdXFZUmF6Y202Z21mMlBGZ0NQU3A3RHBtZmhFLW9lbDJoQ3Vua2ZZS2FieUJrQUZSWTdlSnh2UVZDSVZWbUszUmpEamQ5Zk1FSmhrUnRwVUxGc3U5WXlxbmNNTEtB?oc=5,OceanPact (OPCT3): surgiu um tsunami de oportunidades? Acionista.com.br,positivo,m&a_estrategia;setor_macro,1,"Título sugere surgimento de oportunidades para a OceanPact (OPCT3), porém o trecho fornecido contém apenas o título e cabeçalho, sem dados concretos, números ou detalhes específicos sobre as oportunidades mencionadas."
OceanPact,OPCT3,2026-03-02T08:00:00+00:00,Google News,noticia,"OceanPact, MBRF, Pague Menos, Petrobras e mais ações para acompanhar hoje - InfoMoney",https://news.google.com/rss/articles/CBMirgFBVV95cUxOSXNyTVRkaktXR1E0Tkx0MmVEcTQ3bjVmZG1NazJJa3U2STBPZ2N1SHkzRm9mcW55RGp4alkxZ2VTZ1V4clpjY3BTNnNtR0l2VjJ3YlZqQ2NxcjEyYU5zT0ItQl9vNVNPRnNPTlpPOFd2UFF0WHFjZ3BZb0xMR2hOVlRUNnpVdFdISzI5UV9Td180T3dLUGNJWkNhNDlrM1hQb2VfcUNDOTViUWxrTkHSAbMBQVVfeXFMTk9UZWppXzZCYjRFVkJFMGZhOXgwWWZNdHNMVnAwOUNaTUl3UU5nUk0wSFBDU0ZEV2QyWS1VWVlfdFJKMmdQaXlsUkVHSktiODlmUDN3Y3diRlA5UG9WYjlCOXdhUEw4WWg5eVVyVmQ4czFybW1CcFRybURtUXpLM0pPUjB4dktQUnNXeXA0NF9LN1ZkempHMmNLdmZ6Z3NpcWl2aE1xdXQ3VXlSTDFfLTVBR2M?oc=5,"OceanPact, MBRF, Pague Menos, Petrobras e mais ações para acompanhar hoje InfoMoney",neutro,setor_macro,1,"Listagem de ações para acompanhamento intradiário: OceanPact, MBRF, Pague Menos e Petrobras. Trata-se de um aviso de monitoramento de mercado sem informações específicas de eventos ou dados quantitativos."
OceanPact,OPCT3,2025-12-23T08:00:00+00:00,Google News,noticia,OceanPact (OPCT3) firma contrato de cerca de R$ 500 milhões com a Petrobras (PETR4) - Money Times,https://news.google.com/rss/articles/CBMipAFBVV95cUxNNTJlVGk5UXZiMzVLS2M2cGlucHNETGJtMWdzU2h4eVNaX243TWdZV2M3U3R2R2pPRU5oT0ZVdmN0dlBZR2dNWkJqUk5LdGZzQ1FFNzltdTBDSUhFQ0ItVkwxZHcxN2pFaUFqT0tVYzJfcHpBQzlCXzlUZWc1dTFtZlJneHM1VE5mLXN6dU1hcWoxSUFReXhnd0w1aThKTTFHWDVjRQ?oc=5,OceanPact (OPCT3) firma contrato de cerca de R$ 500 milhões com a Petrobras (PETR4) Money Times,positivo,m&a_estrategia;operacional_incidente,2,"OceanPact (OPCT3) assegurou contrato de aproximadamente R$ 500 milhões com a Petrobras (PETR4), representando uma importante operação comercial para a empresa."
OceanPact,OPCT3,2026-02-27T08:00:00+00:00,Google News,noticia,Gigante à vista: OceanPact (OPCT3) e CBO se fundem para criar colosso dos mares de R$ 4 bilhões - Guia do Investidor,https://news.google.com/rss/articles/CBMizAFBVV95cUxQRU00WE1NSk5KRzB5NGhaTzlmSExyLWtZYWpJWnQ2dklTMzJDN2o1c0VPdUgtcG1NWXZuTlowMlduNzJOVjFCMWhGVm5IR2dNZTNzUzVMbTJtUXZ4MmNwQW1vUllVWGZqVDRBRERVQW5hS3ZKQW55Q2Q3U3ZvNEdWMjIzQnRCeWRNaW15LWFDZzNJQjRXYXk0TXkyYXN3TkRKNHNRbFliQk9iV3N0elhNeE00QnVhVTRfaU1tZ3ZJVXlydTVrSHhqRTYyeTM?oc=5,Gigante à vista: OceanPact (OPCT3) e CBO se fundem para criar colosso dos mares de R$ 4 bilhões Guia do Investidor,positivo,m&a_estrategia,2,OceanPact (OPCT3) e CBO anunciam fusão para criar empresa de R$ 4 bilhões no setor de serviços marítimos. A combinação das duas empresas visa fortalecer posição competitiva no mercado.
OceanPact,OPCT3,2025-10-14T07:00:00+00:00,Google News,noticia,Dividendos no radar? Por que o BBI está otimista com OceanPact e vê retorno de 52% - InfoMoney,https://news.google.com/rss/articles/CBMiwwFBVV95cUxOR1VxSEpsMXA1T3VOV09YRjA4TFJxSF9KNTlzc2NhU0tCdG45NHRuX29rNk9IV3o3LVN3c2VWWGtXTFo5Z3MzVFNvSnFYZldBa0dPM3M4REV0MkRfT0NwczM1X3R0c2xCRVdkMzB2MG5nSTZGd1lsNEc2VHpvMlAxV1FTSkppbHlKTTB0Szc3VE85MzRsWU0xQS1zRnMxVDdIV1laVXRLb3E1cngyNERiNUVxdk5lSWRPNFRDNEdYWDJpTkXSAcgBQVVfeXFMTjFUSDNPSjN6WWw3cXZ1SXhoLTJRVElEcy15eE5jSWVDS25FY0dUTHg1RVFjbmJJRDFoZS0zSXpfZ0JidEhVUU1fZWI2T29takVJOFJvSlF2WUxjYWNMbjNOVmp6SThiS1FVaVE2bFpNbkg5bGE4Z2h3Q05JeFhJOW5nX3NLaFNpcFBPZEFwU3NlWnZfSjRYQXdNdVRudkFJOVRiSU01RExBR2xnWEtBSWlEZ3ZfTDRTTmNYSTc1MkJRRHhqZ0ZsSDQ?oc=5,Dividendos no radar? Por que o BBI está otimista com OceanPact e vê retorno de 52% InfoMoney,positivo,resultado_guidance,2,"O banco BBI emite recomendação otimista sobre a OceanPact com projeção de retorno de 52%, sinalizando potencial de pagamento de dividendos."
OceanPact,OPCT3,2026-03-02T08:00:00+00:00,Google News,noticia,Oceanpact (OPCT3) cai mesmo após fusão bilionária; mercado ignorou boa notícia? - Guia do Investidor,https://news.google.com/rss/articles/CBMitwFBVV95cUxOLS1VS05ZWUdjWmhrN1hIbFFKUklZYkN3S3oyajdmNWFDaWhMVzJIWDJ2QjNlekRfY0dGUEhYVUR4VDhCYW9kVml0RHZ5VGo1WklRVkxZbjEtRUVNQmdqYlN6Z1JJTFQ0R1IzWVAtcEJXalJWRzVIb3YyLXYwQU5CZUFub3FTVm1Mcnd6VTJOYjBMcjZ4WTRYYUNpdVFTVWtMVG11cGZHWFZycXRESE9IUi1meVhPck0?oc=5,Oceanpact (OPCT3) cai mesmo após fusão bilionária; mercado ignorou boa notícia? Guia do Investidor,negativo,m&a_estrategia,2,"Oceanpact (OPCT3) registrou queda de preço apesar do anúncio de uma fusão bilionária, indicando que o mercado não reagiu positivamente à notícia."
OceanPact,OPCT3,2026-03-05T08:00:00+00:00,Google News,noticia,OceanPact reverte prejuízo e lucra R$ 24 milhões no 4T25; receita e Ebitda avançam na B3 - ADVFN,https://news.google.com/rss/articles/CBMiakFVX3lxTFBzNzNEdFJaUktDMlZ6TExJTEV2UHJZNmZtZXFiM3B1czB5VEYxLW5NdXZ4b2NmNzB0LVl6T25PYVBrQjVYT2hKcXI5dVRXMk9lLUIwdTRCTnFkX3EwWFlScFd3NERCNTB0d3c?oc=5,OceanPact reverte prejuízo e lucra R$ 24 milhões no 4T25; receita e Ebitda avançam na B3 ADVFN,positivo,resultado_guidance,2,"OceanPact reverteu prejuízo e registrou lucro de R$ 24 milhões no 4T25, com avanços em receita e Ebitda."
OceanPact,OPCT3,2026-03-13T07:00:00+00:00,Google News,noticia,Preço-justo do InvestingPro identificou ganho de 50% nas ações da OceanPact Por Investing.com - br.investing.com,https://news.google.com/rss/articles/CBMizgFBVV95cUxPUHh3MlBBQnVlbmQ4b3d4d2o4OGN0MkpDLTJyZTNKMnVFa2dyU0R6SWtlcmtfU2pUNVE4eEJQNk5wRThmVjJIU0docHVuLVhUMThfRGxyMkg3eUR1aXIxT2RuVVZHWWJxb1NiLWJNcmFseU83dXhoQXFjRTMtWDZLdkdYMDl3QUM0dzNHeXAwTC1ZNW5ldkxybUlLdG1EQzZqaE5ZM2JRblZBRC0wYVRqLUZoeHZNN2pjZkdQdWd6OVFjaTBVOUJaN2g0cGxTdw?oc=5,Preço-justo do InvestingPro identificou ganho de 50% nas ações da OceanPact Por Investing.com br.investing.com,positivo,resultado_guidance,1,"A ferramenta InvestingPro identificou potencial de ganho de 50% nas ações da OceanPact baseado em análise de preço-justo. Trata-se de recomendação de analista, não de fato corporativo confirmado."
OceanPact,OPCT3,2026-03-05T08:00:00+00:00,Google News,noticia,Oceanpact reverte prejuízo com lucro de R$24 mi no 4º tri - TradingView,https://news.google.com/rss/articles/CBMid0FVX3lxTE5oN2xhMnZFU2hRXzVZY09scDZ0WXI2RUtrc09KVEh3UmZJNWVWWlJFTXNnR3dveE1YYld5QUk5UXl4TGZCN2NzekRiODNUZ3MwQjhWTXd5bGFxQnQ3WG1NQVlXSDF6Nk9WN3JCT29DWjRTOUpTUDd3?oc=5,Oceanpact reverte prejuízo com lucro de R$24 mi no 4º tri TradingView,positivo,resultado_guidance,2,"Oceanpact reverteu prejuízo anterior e registrou lucro de R$24 milhões no 4º trimestre, demonstrando recuperação operacional no período."
OceanPact,OPCT3,2026-03-05T08:00:00+00:00,Google News,noticia,Oceanpact reverte prejuízo com lucro de R$24 mi no 4º tri Por Reuters - br.investing.com,https://news.google.com/rss/articles/CBMisgFBVV95cUxNS1gyX1czLVEzLVctNzhsUXpwemVoR3hjb3lWb3V2ekp5OWdIT1dtMDFpTDVmUlVGakVBRkU4V1FUVkdwU1I0S2FHc1FDVWd5QjNTbEZwbC1SUVlKUEJYNE5FajJyLW9NOTZacHNBdm85UVMzblJYdTAwSnE0SzVWWXdOeUZKOTdkTmF1NUNWVThIa0F6WnRjWEVkUTVOV3V0Q0g4SkJtSmFzbVBTb0o4WVdB?oc=5,Oceanpact reverte prejuízo com lucro de R$24 mi no 4º tri Por Reuters br.investing.com,positivo,resultado_guidance,2,Oceanpact reverteu prejuízo anterior e obteve lucro de R$24 milhões no quarto trimestre. A empresa apresentou recuperação significativa nos resultados do período.
OceanPact,OPCT3,2025-11-13T08:00:00+00:00,Google News,noticia,OceanPact reverte prejuízo e lucra R$ 58 milhões no 3T25 - ADVFN,https://news.google.com/rss/articles/CBMilgFBVV95cUxPcnptYnRoS2tjYTllTTBZampQdnRjYjUzbTZScXFMLVc4T2NBRXU3R3JNdTZSNUJRRXRlU3l2dnNwMlBSSWNFcUxiRUl5by1FZnNUSWRtTFJzbjZsTnNPcVBqWHJ6Q1kzTml0OUF0WUtzREVWdTBsT05DclRBMG5RM29wdC1BTXd6S3hKazZWem9IQ0JaV1E?oc=5,OceanPact reverte prejuízo e lucra R$ 58 milhões no 3T25 ADVFN,positivo,resultado_guidance,2,"OceanPact reverteu prejuízo e obteve lucro de R$ 58 milhões no terceiro trimestre de 2025, demonstrando melhora na lucratividade da empresa."
OceanPact,OPCT3,2025-11-12T08:00:00+00:00,Google News,noticia,OceanPact (OPCT3) registra lucro de R$ 58 milhões no 3T25; receita de R$ 614 mi e EBITDA de R$ 213 mi - Visno Invest,https://news.google.com/rss/articles/CBMizgFBVV95cUxNRmVuMjVkY0dha2VwdGZRUlR1ZjY5ODJ5OVZ2VnNpbFFOSkJUWE5xcDFJS0xjVXdIRUFxcGlVbnFlLUpmVVJjQkRabnFDMm5HaEcwNWtQVE5XM01xVEYwSV90ZGR1NlR1c092Z0VrLUJGUHNPcFAyUjEzNWZ5QnRjYW1HajlkYi1VdUh3WVgwVllTbzVENDlUaEtPNndOR2dqTDdwYmFTeXNZVldlNXRBdHNqME5BcmotSTVTWmhxT3lpejZucERYUi13aEp4dw?oc=5,OceanPact (OPCT3) registra lucro de R$ 58 milhões no 3T25; receita de R$ 614 mi e EBITDA de R$ 213 mi Visno Invest,positivo,resultado_guidance,2,"OceanPact reportou lucro de R$ 58 milhões no 3T25, com receita de R$ 614 milhões e EBITDA de R$ 213 milhões, demonstrando desempenho operacional positivo no trimestre."
OceanPact,OPCT3,desconhecida,RI OceanPact,comunicado_oficial,Atas e Assembleias,https://ri.oceanpact.com/governanca/atas-e-assembleias/,,neutro,governanca,1,"Notícia refere-se a atas e assembleias, possivelmente de caráter administrativo ou de governança corporativa. Sem trecho disponível para análise específica de conteúdo."
OceanPact,OPCT3,desconhecida,RI OceanPact,comunicado_oficial,Resultados Trimestrais,https://ri.oceanpact.com/informacoes-financeiras/resultados-trimestrais/,,neutro,resultado_guidance,1,Anúncio de resultados trimestrais sem informações específicas disponíveis no trecho fornecido. Impossível avaliar impacto sem dados concretos de desempenho.
OceanPact,OPCT3,desconhecida,RI OceanPact,comunicado_oficial,Debêntures,https://ri.oceanpact.com/debentures/,,neutro,liquidez_refinanciamento,1,"Notícia refere-se a debêntures, instrumento de financiamento via títulos de dívida. Sem informações específicas disponíveis no trecho para análise detalhada."
OceanPact,OPCT3,desconhecida,RI OceanPact,comunicado_oficial,Divulgação dos Resultados 3T18,https://ri.oceanpact.com/#,,neutro,resultado_guidance,1,Divulgação de resultados do terceiro trimestre de 2018. Sem dados específicos disponíveis no trecho para análise detalhada.
Brava Energia,BRAV3,2026-03-30T19:25:09+00:00,Google News,noticia,Brava Energia (BRAV3) dispara após iniciar perfuração em novos poços - suno.com.br,https://news.google.com/rss/articles/CBMikAFBVV95cUxNNkxBbVNoLWhEMmcxSGFMYi10UUt3TWYxeF9lOENaWmNoYVBWNnlVeV9uVmM5Tnd3SzBod3NQSHE1ck85MzBMcmEwZVpzdGtzM0pFZXVNdmZqNm1NeFRXNUJmRjE5cjhVaTBPMGVtZk9keERHLUpOV0hyZ1ZSdkxZb3JzY3o1RDNNc3lYclNzalDSAZYBQVVfeXFMTktvb0tacDhjclFmemUwRUY5c3FmeGFqQzdiSU1pODc4dzd4NG1NVFE2QTYtemVLNm5SY0V1WkZpaEU2OFNxQk9MZnJsdmhmNHNtUlBZaFFIcDFDc1Y3aVhxS3hOVXNFaW14U1M5OGtJemg1dThScjF5X2lVcDdUMjhaYWI2REZnVUhmQjBhV3NjSmI5RmVB?oc=5,Brava Energia (BRAV3) dispara após iniciar perfuração em novos poços suno.com.br,positivo,operacional_incidente,2,"Brava Energia iniciou perfuração em novos poços, resultando em valorização de suas ações (BRAV3). O evento representa progresso operacional na exploração de petróleo."
Brava Energia,BRAV3,2026-03-17T07:00:00+00:00,Google News,noticia,Brava Energia (BRAV3): Petrobras mela planos de expansão e ações despencam - Valor Investe,https://news.google.com/rss/articles/CBMi8gFBVV95cUxNcFplSlRYcUI2b3ZWZjhxdnFBOXZMeVZxbTlfR2ZBdEI0OUdTMFV4ay04VjF5YTFiVzZaQ3JBRzRiR2Vhcnd0dEd6MmxnQmpySkFHTjd4Nk4tdWh1RHM0R0hKN2tmOWhfdmlBSmtGMVoxeVRCMzlaMDVBSTY2dXQ4WmN3LTNqRklubVhFUHdxLXNrV0RaSllzT0ZsdVNjWmRTYXY4SlFnSkEybXh6Nk1PWkNnX2NRTExvZlo1VXBVdy1udTN3Nm80NE8xN2Y1UUh4ZDFScG1yTW1nUHJxcEJTVm9ETTNFeEhvZ2dQZXFOTTZKd9IBgAJBVV95cUxPaFBoUTBaR0RKVmJJMDZhS00tYlBqenFGWmxUczd1YnFfM0lxd3pib3ZJal9xVl9aLXlHQUpfY1puN0E2LTdPYjdkTTg1VjFpTlVqWEZZLTlrSmtBZVQ3c1dKTEZlMHcyVTJtVHFILWc4OVp5SUR1dHYxXzhrU2tadmFWckducUlmZVQ3SWR1LVlrMGJHT1VaaGVlS2FBTUxQSXRBdlloWnJwM0FTcFFYS1JVaGRnZExrSUVqb0N2bGphMkpVN0JjTUQzQ2hqTHFfTGFWRE80aDVBQnhtekN6R1cyY0JmN2dZdGZRUFRtSUl5REdRdjF6OTFTb2kxN1pu?oc=5,Brava Energia (BRAV3): Petrobras mela planos de expansão e ações despencam Valor Investe,negativo,m&a_estrategia;operacional_incidente,2,"Petrobras adiou planos de expansão da Brava Energia (BRAV3), resultando em queda significativa do preço das ações da companhia."
Brava Energia,BRAV3,2026-03-30T21:28:31+00:00,Google News,noticia,BRAV3 acelera produção e mira novo salto: perfuração pode mudar jogo da petroleira - Guia do Investidor,https://news.google.com/rss/articles/CBMivwFBVV95cUxOYXRwMkRDYmZwMElHM3gxMElfRWtaRzBYZ3lLU2p3WDRka3NfVEQ1NV9QTktGY3FUdFJENTJlVk5NSDltQnRXVEF1R2pCSUF6bVI4U3hsdnAxUEhrYVYxYVhqWHhPaGxybS1VLXRHT3NHTThQXzZtaHN6dWZ3VHJUazJuYjJNaWprZzVpRXNkbDFvWmRlTXZQbmp0MFZaRUFvdW5paWJDNFRiY0ZkZXRQZ2t5NC0zTGVBeE4xdnVKTQ?oc=5,BRAV3 acelera produção e mira novo salto: perfuração pode mudar jogo da petroleira Guia do Investidor,positivo,operacional_incidente;m&a_estrategia,2,BRAV3 acelera sua produção e planeja novo salto estratégico através de operações de perfuração que podem transformar seu posicionamento competitivo no setor de petróleo.
Brava Energia,BRAV3,2026-03-12T06:59:59+00:00,Google News,noticia,"Brava Energia (BRAV3) | Resultados do 4T25: Sem brilho, mas dentro do esperado - conteudos.xpi.com.br",https://news.google.com/rss/articles/CBMiuwFBVV95cUxPdU5lZHFPOVgwNk5WYmlKcEdlWGEtVTFsUEhrZ3d3RUM4TGxpU20tWVFLYk9VVFloeElPQTRKamp4Z3NiYlFndk1FcVQzMGFtU1NMUlRoU2hydHo1dEpvNUxzZTlhSzJBR1FnMV9kWkJGcmtxcUFaSTdpeTNrT0k0clNjMGQ4bnUxN1lYTFg3VGVOSnFpa1dwSTJ0SDQ5VnpPUlpkbEVOY3htb0Zjc1NBUzczbUpfRWE1TERZ?oc=5,"Brava Energia (BRAV3) | Resultados do 4T25: Sem brilho, mas dentro do esperado conteudos.xpi.com.br",neutro,resultado_guidance,1,"Brava Energia apresentou resultados do 4T25 dentro das expectativas, porém sem destaques positivos significativos."
Brava Energia,BRAV3,2026-03-30T14:50:00+00:00,Google News,noticia,Brava Energia (BRAV3) anuncia perfuração em quatro novos poços; ação dispara mais de 5% e lidera ganhos do Ibovespa - Money Times,https://news.google.com/rss/articles/CBMi4AFBVV95cUxNYmxGRlRPaVp0NkFZclphTjJoMW9MSURIRG5pSnJTOVFJTFVrekd1S2xNNGtONmgyV0hDVld1NnhyWi1GQlE4cTk0YldkTDlIVG11OUYxMFRRRTdfdVdtZ0dINkZycUFZZHgyTzFvZGtQN0pHcnAtZzdUQlk0Y0w1RXVQTDlRQXI4QllCdTlPY0ZNVnl4ZVN4VHR1bVhsdVBGQm85Zld4Y0tkaVB2aHdKdDgwRnFzM1c2VUM2NEduMWFTS2NIX3NMb1kzMUc3OFVpRWFuVkVCX0lhNVRUSGd2Mw?oc=5,Brava Energia (BRAV3) anuncia perfuração em quatro novos poços; ação dispara mais de 5% e lidera ganhos do Ibovespa Money Times,positivo,operacional_incidente;m&a_estrategia,2,"Brava Energia anuncia perfuração em quatro novos poços, resultando em valorização de mais de 5% da ação BRAV3, que lidera ganhos do Ibovespa."
Brava Energia,BRAV3,2026-03-30T16:45:35+00:00,Google News,noticia,Brava Energia inicia perfuração em Papa-Terra e Atlanta e impulsiona produção de petróleo - ADVFN,https://news.google.com/rss/articles/CBMiwwFBVV95cUxPRWlfWmdLekt5SEdabUtCZXNOMEFYX1FEVGw3Z2ZaaEhxRUhRdDB1c2s2VDM0WThqRjhtWGNuWHg5RGd5RTZSckZMTjF0SDNYeHFVWS1xRWx3REFLcjN3a2FOaUZfeHVCOG9pV2E5aFh5eEZ6ekNWVlVpWXVHUFNVTmVET3prbUU1Q01Ka0tNVTZmUG9IUFRlalpmTFV1eTE5WDRFajlELU1ZOEtvdEZhdER3VlIyWjdqMXpRTFhHNm9mbHc?oc=5,Brava Energia inicia perfuração em Papa-Terra e Atlanta e impulsiona produção de petróleo ADVFN,positivo,operacional_incidente;m&a_estrategia,2,"Brava Energia iniciou operações de perfuração nos campos de Papa-Terra e Atlanta, visando impulsionar a produção de petróleo."
Brava Energia,BRAV3,2026-03-30T16:21:06+00:00,Google News,noticia,"Guerra, petróleo em alta e novos poços: a combinação que colocou a Brava (BRAV3) no topo da bolsa nesta segunda - Seu Dinheiro",https://news.google.com/rss/articles/CBMi7wFBVV95cUxQbEhRMUc4UTd2R3cwRUtmejhSTkszc0hHMEliRXNRQzlfenlQUXhsS284Z2Z6MlhIVHZBaWQ2MXBiSm15Q04zYXJJOWY3TTlYb1B5aWJNMFRGOV9CS2JhaW90NFdmQlVQS1hzcmhfZUNjTFEzcFE2aFZNWlpXS0thb2FQbjdjUC1fMTRtbjV5SXQxVkdfZ0haYkNkS3BzZEZtcUVCRDlqZ3dKVnVtQkpoX0d1VER2X3FZenFMTWdDXzE4UXpPa1dJMnNkWGE2cE5RZDRaZE9zazVhOTJTUUx2a2RhOGE5a0dKYkhOSDdxTQ?oc=5,"Guerra, petróleo em alta e novos poços: a combinação que colocou a Brava (BRAV3) no topo da bolsa nesta segunda Seu Dinheiro",positivo,setor_macro;operacional_incidente,2,"Ações da Brava (BRAV3) lideraram altas da bolsa na segunda-feira, impulsionadas pela combinação de conflito geopolítico, elevação dos preços de petróleo e expansão de novos poços exploratórios."
Brava Energia,BRAV3,2026-03-31T10:38:27+00:00,Google News,noticia,Brava Energia (BRAV3): luz no fim do túnel apareceu? - Acionista.com.br,https://news.google.com/rss/articles/CBMif0FVX3lxTFBtcExmUlhpZ3lhY0N1Mm1oZjFuVFBIcklpZDk1R2lhM3lnX3BMdG4yVjVZYzNqaGdwbUZ0LUJkM1pidk94U2YtaF9jZE1STzJLZ2J2M1UzOEhXX2xGWkUzeGlnSFd4VTFodnllTzBCMERoYXdYTGR6QVZDb0xCdjA?oc=5,Brava Energia (BRAV3): luz no fim do túnel apareceu? Acionista.com.br,positivo,operacional_incidente,1,"Título sugere perspectiva otimista sobre a Brava Energia (BRAV3), indicando possível melhora na situação da empresa. Conteúdo disponível é insuficiente para análise de dados concretos."
