empresa,ticker,data_publicacao,fonte,tipo,titulo,url,snippet_ou_trecho,sentimento,tags,severidade,resumo_curto
Armac,ARML3,2025-11-03T08:00:00+00:00,Google News,noticia,"RD, Armac e Log têm recomendações elevadas por bancões; entenda o que leva a otimismo - InfoMoney",https://news.google.com/rss/articles/CBMiuwFBVV95cUxOVDk1czBxdUdCSnVuZ3V5ZHlyS1dwOGEyVVVvMU1CdFZqdElsMmxhNVJlOW9jaXZLRjZ0dDhmNFN2ay1jdkYtYkFJaC1Ec3pqcVdSNndtaG0wRDQ2ZEEtajBmWTFhWjZDbDdjSFh4OExiYWZvd3RoSFpzek9ORE95dllpNkQxQVRweHg1c01RcUdtdmE5VFhHUUJUR21kc1gwcjhMTjFuSE9IWW5pRXJYMV9Qc21waldVYUc00gHAAUFVX3lxTE54UWhPcVEyZHBEN0pSczY5WFlxanhsTXlkbmtvSm5pbEVjaGF2LTVnUlRvUDRBaUJEclFSWXN5ckZvbEduS2h0M1BqanRnYkFLandhUmhUM205VXMtYU5BVk9yWjVMeGEwOVRaajM1eURlSzhMbjR0cmlCZWQybEROV2UybE84ekZmR1dSU1R2Rm15RkJCTnk4dmpzUUtOUHlmY2VJMVhHdjJnajZwWE5iNUEzb1Z0TVU2dFpiRHQwQQ?oc=5,"RD, Armac e Log têm recomendações elevadas por bancões; entenda o que leva a otimismo InfoMoney",positivo,resultado_guidance,2,"Três empresas (RD, Armac e Log) receberam recomendações elevadas de grandes bancos. O otimismo dos analistas é atribuído a fatores positivos dessas companhias, conforme reportado pela InfoMoney."
Armac,ARML3,2025-10-10T07:00:00+00:00,Google News,noticia,"Armac (ARML3) pagará quase R$ 21,7 milhões em JCP - Investidor10",https://news.google.com/rss/articles/CBMilgFBVV95cUxQWnV1bkExSko4UnhNUDZiMllCcFA3eS1XOENOVnk0c3FrNmJJVnJGSXJpWnZIVjdmbTNyVk9IVUNTXy1FVndGMUYydTU4N3JvM2I1S3hCMllZYldnZjJFaW0yMGNWRkNSRUlkY3pGaE5QLUVpYzl0d1k3ZjAxZExGaWs2aHBweXM4QnMwenZXVHpITVZzcXfSAZsBQVVfeXFMUE9mLVRLajJMWjhkSEtuMF9rS3RZa2F1OGZCRVU3el9Wa3c3VjZsb1FTR21lUkRBNGxZaldFckUwWGc1SWc4ajhGT1RWNkhZOTV0LUY2YWVTMTByZ3hNMlJIZ2ZVSEdRZDRycjhjVDZIbkJNZzNlR3pHbFotTi0yYlNBMHE2amJsYXcxbVMzNVNNNWl1emFXSVl5dTQ?oc=5,"Armac (ARML3) pagará quase R$ 21,7 milhões em JCP Investidor10",positivo,liquidez_refinanciamento,2,"Armac (ARML3) pagará R$ 21,7 milhões em Juros sobre Capital Próprio (JCP), demonstrando capacidade de retorno aos acionistas."
Armac,ARML3,2025-12-27T08:00:00+00:00,Google News,noticia,Small cap aprova distribuição de R$ 140 milhões em dividendos e juros sobre capital próprio - Money Times,https://news.google.com/rss/articles/CBMi1AFBVV95cUxPVU5tY0h6aVNrOWNDQVRyNmM4NWtpZlBnV2ljMTNiaU1qRmZSdFR4QV8wUS1IVnJrOVRnSlJnVXpmX1RjMEJjZlZJbVdjNm1sUkxLaHpQN1hPcVdfZWNxT1N3TUJDV0V5YU9Zc1Y4cmc5aEY5cVQ3NGpRdzRlTDFmT1B4MFpuRm00OGhZWkE4ZkpkZTE4Qk1veXhtOHE2dWR3a2JaZGNyMXNhbnlyOGw4akNsN3RSY29aNHJNc2dJSzk4SHhwYzRoSmRDR1N2QmN1VkpJQg?oc=5,Small cap aprova distribuição de R$ 140 milhões em dividendos e juros sobre capital próprio Money Times,positivo,resultado_guidance;governanca,2,Small cap aprovou distribuição de R$ 140 milhões em dividendos e juros sobre capital próprio. A decisão indica geração de caixa e retorno aos acionistas.
Armac,ARML3,2025-11-27T08:00:00+00:00,Google News,noticia,"As ações desta companhia podem valorizar até 19,8% hoje (27); veja como lucrar no curto prazo - Estadão E-Investidor",https://news.google.com/rss/articles/CBMipAFBVV95cUxPS1ZhazdmZnJwNUYwZVRXQW1sVTNzWHNjbkRPd216a0ZQbWM0akx6NDZodGJjemlRaTVtQ2FnRXRlQVpHZ3EyZjE0dzNOc0hmc2xzVm5kTzduYzRBd1pVSHBjdU9WUXBfVjVxdVR6WVFkcUN4Q3ExODR6YnBWRFhtTE02LUZNajdQSVBqZ3lTZDFKeUJjTWNydDJZREZwTkF0WlE2S9IBqgFBVV95cUxNdlItbFlUVGptY2R6SXRtMk5renNMZFR3SklKS2JNcGxqWnJMVXJuRFR4OEg1X0pySmpZWEFKckdwMHN6R3lvdkZQaUR5YnhXV2FTV3I0R29WcWoteTV3N3pnSHBoTm16dFJxalFtRHZqYU1ncTNTOE1Fd0hBRm9aQ2NQdlVYa3dtb3BqTEFUbVM2TkVOQ3BIdnozSUdDYml4MXJJWmRLMUlhUQ?oc=5,"As ações desta companhia podem valorizar até 19,8% hoje (27); veja como lucrar no curto prazo Estadão E-Investidor",positivo,setor_macro,1,"Notícia especulativa sobre potencial valorização de ações de uma companhia em até 19,8% no dia 27, com foco em estratégias de curto prazo. Trata-se de conteúdo de análise de investimento sem dados concretos sobre fundamentais ou eventos corporativos específicos."
Armac,ARML3,2025-10-13T07:00:00+00:00,Google News,noticia,Conselho da Armac (ARML3) aprova emissão de R$ 500 mi em debêntures - Investidor10,https://news.google.com/rss/articles/CBMirgFBVV95cUxPRXBDeFBsTU4wMzNuRnVRZTFGanRveDA4cDlKUVUwNnhVM3l2SUdKcmxxWEloUlZkWUw0VHFNY3NWSW1PemxDTzhHTnhUQ1cwbXpfOFgxR2x0U0NUXzMzeEpucEN4eUozNk1TNVEyNXdfVGxxcV8wQmQ2QTNJR3ctUkRjdG1kODZnTlFjY3gtTlhLUFdudXFoa1NtRXVjTms2cEhJUkFybjQ0dXR1ekHSAbMBQVVfeXFMTjczUU51UW5ITGN1MjZEUjhrcmJHOGpheGkxWDZfRWVJaEtKd3hOemMtVVQzR3h5UDM4aWJfVlB4cWo0aXdRVEN6aXU2dDk2eU96V192T2lrcXRQQTZKQS10MWdaMnRSSVcwNkw1b3JiLV9LNEpiZXNZNkdaU0JWUWQxSkxqcjRSTlVKaFlhRG90TTczeTBzNDU0eEJrVGU0VG12dUktREJjeGl1V3FtYzF4cEk?oc=5,Conselho da Armac (ARML3) aprova emissão de R$ 500 mi em debêntures Investidor10,positivo,liquidez_refinanciamento,2,"O Conselho da Armac (ARML3) aprovou a emissão de R$ 500 milhões em debêntures, operação de captação de recursos que fortalece a liquidez da companhia."
Armac,ARML3,2025-12-11T08:00:00+00:00,Google News,noticia,"Day trade: Compre Armac (ARML3) e venda Hapvida (HAPV3) para ganhar até 1,55% nesta quinta (11), segundo a Ágora - Money Times",https://news.google.com/rss/articles/CBMiqgFBVV95cUxQX2drRkxPUWJXX2RFNWRmU05OT3RSakVHSmVOQ0tTWms1bEJnTVVCdFBoMEF6c2U0ajhNRnVUZUhGVUN0TWZmVTZ4YWFHU24wV1paZlZRd0JUX25NUTlES2FtSzdSS2o3LXVnMmYxNFc2RkxUSjNXY19weTNYa0xYQzNUZ3c2NHFucm9Ec2pBa2QtZzc5Zk9BY3ZuSVdpZHdsYnV3emJVNmZYdw?oc=5,"Day trade: Compre Armac (ARML3) e venda Hapvida (HAPV3) para ganhar até 1,55% nesta quinta (11), segundo a Ágora Money Times",positivo,setor_macro,1,"Recomendação de day trade da Ágora sugerindo compra de Armac (ARML3) e venda de Hapvida (HAPV3) com potencial ganho de até 1,55% para a quinta-feira (11)."
Armac,ARML3,2025-12-29T08:00:00+00:00,Google News,noticia,Armac aprova dividendos e JCP e reforça retorno ao acionista na bolsa de valores - ADVFN,https://news.google.com/rss/articles/CBMiakFVX3lxTE4zd3AxQ0dRbWJWNjNPRHU5MlIyVWdoRXU3M3RGRVBCd3VOS3hXOEZvNC16Q3RUM3VpRlVaZWNnTnhwbGlBZU40OUg4aUZmN05JS2NmTE5QamVTTGRSV3lBRW14ZEFLR3M1RHc?oc=5,Armac aprova dividendos e JCP e reforça retorno ao acionista na bolsa de valores ADVFN,positivo,resultado_guidance;governanca,2,"Armac aprovou distribuição de dividendos e JCP, reforçando o compromisso com retorno ao acionista. A notícia destaca a aprovação de pagamentos aos acionistas na bolsa de valores."
Armac,ARML3,2025-12-15T08:00:00+00:00,Google News,noticia,"Juros altos castigam locadoras, mas Mills (MILS3) se destaca como favorita - Valor Investe",https://news.google.com/rss/articles/CBMi8gFBVV95cUxQM2VNUWJ2ZktpNEc3X1JOTXdSay1ZeFdQaUExdG5xREo3RTFDU0xWY1V2N2lJM3M0MGlWcmUyYXkyV1BXZ3paeTJhYkZ0M08zTGtDNHBnMnJUd19XUER3VVl3YWwzX1lBSTE1NWdISDlkb1pkWlR3NUUtX0E0ckZSUE1mYzctbDY2Q2N6aHY3TEs2RjZ6cUJUaEVBVkdyM2hfeXNwSTZRR0NXTzNGSy1EWXFKWUZzWWdSX2JQMjlFTDlQY2RBN2EzQ0Q4UlNpVThPVUdsU1pNd2JRZGV3dld3NjI0UDJfa1RCeXhiQTdkZnZqUdIBgAJBVV95cUxPNzdKWGFYSGpuVURfdDI5MnNBOVhDQ2RWMTZ4ay0tNGxTVjFzM2VfcDY4eGc4RmdROGhSaUtCNU93TTR5dmhEYzhKSVE5WVkwN1BIcS0wYW45dzlTSHl0THRzTU02VWFFTEZVZTdnajRueUFya2FvdVZHalV4WHNBV1d3ajFwUVpfN2ZIWUt4VVg3UVNITGJqdElLdG8zYU4xc04zMjg3WGJGZEhxOWY3SzlFbmE2YnRmYUVRT1JKRmVQLWNCUXNKeTdEeHE2ZHpSMTJnYm1HYjBReXJuQUxsNENjcDRxeUE2MzR0Q2lSLXdWN1hJZ3FXVkNpTWdwVWh4?oc=5,"Juros altos castigam locadoras, mas Mills (MILS3) se destaca como favorita Valor Investe",positivo,setor_macro;liquidez_refinanciamento,2,Mills (MILS3) é destacada como favorita entre locadoras em contexto de juros altos que afetam o setor. A notícia indica posicionamento competitivo relativo da empresa em ambiente desafiador.
Armac,ARML3,2025-10-13T07:00:00+00:00,Google News,noticia,Armac aprova emissão de R$ 500 milhões em debêntures para reforçar caixa - ADVFN,https://news.google.com/rss/articles/CBMiqwFBVV95cUxNUEVGVVFjbDdDSzd1QTVLcjFlYjQwWFZ1eUdUa2V3MVZ5cXhoaHZnTy1fOXFuVC1iem9DNFFoTzJoM2JsT0xPRElCU0FuV1NWaktFMTl0R3AzeWNqUU9RM2RBV3MyWkxsUjMxdHg4Vy1SY2RudW9BVXI0b1hsTFl4YmxlWnRlVGJleWxwVXJ3Q2hCWE5WUE1RMDNDZmtXLWE5YUg3UDU2UGVUbDQ?oc=5,Armac aprova emissão de R$ 500 milhões em debêntures para reforçar caixa ADVFN,positivo,liquidez_refinanciamento,2,"Armac aprova emissão de R$ 500 milhões em debêntures para reforçar sua posição de caixa, sinalizando necessidade de liquidez e acesso ao mercado de capitais."
Armac,ARML3,2025-11-12T08:00:00+00:00,Google News,noticia,"Armac (ARML3) registra lucro de R$ 38,3 mi no 3T25; EBITDA ajustado é de R$ 199,3 mi - Visno Invest",https://news.google.com/rss/articles/CBMitgFBVV95cUxQelFCWTl5SGc0dWJlUVBpOGFDOWl5MUVGTi1FRlNQRUNOaE8wdG90enhaT0tCVXJ3UDJ0Z0N1a2N4b1NBZGRZT0UxaWhfbHNoWlVnS1d2eTN2YmdtckRBaDI5cHZPQm1KTVdTcVpjTVRaeTR0TExTRU84cnZhcmRjUmVlSFBZSHhQRG1iZTZrNjByNzBtY2lrazlrWkpPcDZCQ2c2Mm9ZX0pnQ242NTJIalNTSFpvdw?oc=5,"Armac (ARML3) registra lucro de R$ 38,3 mi no 3T25; EBITDA ajustado é de R$ 199,3 mi Visno Invest",positivo,resultado_guidance,2,"Armac (ARML3) reportou lucro de R$ 38,3 milhões no 3T25, com EBITDA ajustado de R$ 199,3 milhões, indicando desempenho operacional sólido no período."
Armac,ARML3,2025-10-10T07:00:00+00:00,Google News,noticia,"Armac anuncia pagamento de JCP de R$ 21,7 milhões; ação reage em bolsa de valores - ADVFN",https://news.google.com/rss/articles/CBMitgFBVV95cUxQRlppSDlidTRyRldUVTU5NFBPT3VodkFJSHJ3LTNxbmdsREZRWnJyWVZER0NrMlRuR05NQnVOQzhIdFlabE5yQmpXX2dqdGlISVhObWt6Q3NROWVhLURZRTdoa3U5T1ctbFE5VlpTWUJ5MVR6MFRMUWhrbGFuV21tR2NXQTA5Wk9HMmRXLU94OGdRTVMtbXdGeUJIMVd3TmdQZE1ZSnplSDBvaHJGbnh1NlRoMkJoQQ?oc=5,"Armac anuncia pagamento de JCP de R$ 21,7 milhões; ação reage em bolsa de valores ADVFN",positivo,liquidez_refinanciamento;governanca,2,"Armac anuncia pagamento de Juros sobre Capital Próprio (JCP) no valor de R$ 21,7 milhões, gerando reação positiva do preço da ação em bolsa."
Armac,ARML3,2025-11-03T08:00:00+00:00,Google News,noticia,"Bradesco BBI vê ponto de inflexão para small cap e sugere compra, de olho em potencial de alta de 60% - Money Times",https://news.google.com/rss/articles/CBMirgFBVV95cUxNa1BIc1ZKcnFMNTF3Sm94eUF6ci1PRGJRT3E2QVhINFp5dFRkQ3RXQXZ0STQweExSVDUycGxrTlR1TGFNcHdSWkJMc2RMWUVBRnJGdWlvX09BSld0N2tVdnk1c09WQ1hfWGRsVGNXZmFuYVhBd18wMzI0Qm5aVkd1Zkt6UVRmcDN3TVVoUC13UlJVMmZEelhrdXZlbTYtY0hPWnlyb1B6T2hMUUx0Vnc?oc=5,"Bradesco BBI vê ponto de inflexão para small cap e sugere compra, de olho em potencial de alta de 60% Money Times",positivo,setor_macro,1,Bradesco BBI identifica ponto de inflexão para small caps e recomenda compra com potencial de alta de 60%. A análise sugere oportunidade de investimento no segmento de pequenas capitalizações.
Armac,ARML3,2025-11-06T08:00:00+00:00,Google News,noticia,Armac (ARML3) assina contrato para adquirir 60% da Engelog Fornecedora - Visno Invest,https://news.google.com/rss/articles/CBMiqAFBVV95cUxPejZiOENhWmxNc0hvNlhfNmxwMFh6S1B4N3RwbWRRRXdYS2M0M0N1UjZMR1lqRWhtR0dVRC1Bc0RQX190cUp5U3ZlenZzTHk4bC1JRkkzd2VXMlNyXzgzcVRNeGNRdXFGem5TSnB4TU1Ta2I0RWl6cjBxb0ppdXJvS2lCSGppcmdGMHU1V0g0VzVpQ043cjMycVRPc1lIRUhCUW1BT0xaTkw?oc=5,Armac (ARML3) assina contrato para adquirir 60% da Engelog Fornecedora Visno Invest,positivo,m&a_estrategia,2,Armac (ARML3) assina contrato para adquirir 60% da Engelog Fornecedora. Transação representa movimento de expansão estratégica da companhia.
Armac,ARML3,2025-11-28T08:00:00+00:00,Google News,noticia,Armac (ARML3) assina acordo para adquirir 100% da Braslift; enterprise value de R$ 155 mi - Visno Invest,https://news.google.com/rss/articles/CBMivwFBVV95cUxNT25SUTR2OUZxcWZDLUp4Q3BMY1A2VkNFNnRjRWtvVXdYZ0VwSTQ4c1dQSFU4aHpzOE5sTHptZGVaVWtoY0ZOM21pdEtZejNJQjBYVExGT3VJa3drU2d6WHVhd29WY3htWlA3VWs0dlM0dDE5dlFsZWJOUVBnc2lvd3BISk42X2FOMkZoQmR4bXJQTVp3YXhWc1RuMHV2SGlTWHNUaHg1UnVlTVQzVi1YanBiaFZycTdtUGZlaDhmcw?oc=5,Armac (ARML3) assina acordo para adquirir 100% da Braslift; enterprise value de R$ 155 mi Visno Invest,positivo,m&a_estrategia,2,"Armac (ARML3) assina acordo para aquisição de 100% da Braslift com enterprise value de R$ 155 milhões, representando movimento estratégico de expansão via M&A."
Armac,ARML3,2025-11-28T08:00:00+00:00,Google News,noticia,Armac (ARML3) avança no setor e compra 100% da Braslift por R$ 155 milhões - Guia do Investidor,https://news.google.com/rss/articles/CBMisAFBVV95cUxOT3g1N09La0FxNzZURnZkaE5ackVxaVJKdTZ1NF93WFotWW9rTENzSkRfWG9jWkEwaHdrZ1VHbVF5akRzUWRqQjBtS3MyMThkMTRmODFRRW1CLVhfNlRpWW13Q25jYUNxNGt4X3FQbHZ4WVJycjNIaTRGQ01hN1I1NG9qV1VJby14U2hiVVBIQWkxNUpOZkZkN19rOXE5X0FxamNqSHd5TnA4OUFGb1pJWA?oc=5,Armac (ARML3) avança no setor e compra 100% da Braslift por R$ 155 milhões Guia do Investidor,positivo,m&a_estrategia;operacional_incidente,2,Armac (ARML3) adquiriu 100% da Braslift pelo valor de R$ 155 milhões. A operação representa expansão estratégica da empresa no setor.
Armac,ARML3,2026-03-31T11:52:42+00:00,Google News,noticia,"Armac (ARML3) tem lucro líquido de R$ 29,7 milhões, alta 162,8% no ano - financenews.com.br",https://news.google.com/rss/articles/CBMioAFBVV95cUxPUFpLYXJqQmZyMndQWG1tUXNIYzVGSzhOTl9WOVE5MzF3ZnhFMG5NUWs5UVhFMkxGaW5yTldrNG9uUzRDS013SDlmUDh2Ml9ZOFd5bHczbTNLemFvcExpaHItaDh2STFCV2tqVC11dGc2WF9uLXZiTjA1TmFvUF9qZW42eUVsS3NycjBzVVVjYXExcURXaHZEUFJHRUd1WkFi?oc=5,"Armac (ARML3) tem lucro líquido de R$ 29,7 milhões, alta 162,8% no ano financenews.com.br",positivo,resultado_guidance,2,"Armac (ARML3) reportou lucro líquido de R$ 29,7 milhões, representando um crescimento de 162,8% no ano."
Armac,ARML3,2026-03-13T07:00:00+00:00,Google News,noticia,Moody’s Local Brasil atribui rating AA-.br à Armac (ARML3) - financenews.com.br,https://news.google.com/rss/articles/CBMilAFBVV95cUxPRFVZSTI0LW5naU9BU0FDQjZEd0NaSWh4TkZOTTQzMU1OVlFvUTNPRkdQUElyOGlwTjNuYkRKQWwyYTkxSjhQNTAybGZ2eU9SVzFlZUFKWHR1a1psaVVVUlRROTJ0dEx4Uk5YT1NQeDdLSXEzT000eXRnNnNvMmRCdW0xQ0o4LUlfWHpEcmc2REc0OWF0?oc=5,Moody’s Local Brasil atribui rating AA-.br à Armac (ARML3) financenews.com.br,positivo,governanca,2,"Moody's Local Brasil atribui rating AA-.br à Armac (ARML3), refletindo avaliação positiva da qualidade de crédito da empresa."
Armac,ARML3,2026-03-02T08:00:00+00:00,Google News,noticia,Armac (ARML3) conclui aquisição da Braslift - financenews.com.br,https://news.google.com/rss/articles/CBMigwFBVV95cUxPdVpRTnQ3N0JwdnhObXRINGcwY2QyZVU1ZHNQdVNnQXFKV29JcDd6SDJnQWlIejk2TkZPdzg5cEo4NmtleUNSSkhPZzM5d2dyQkZRVnRhSkVGT0FYcVJpYTMxcnF1T1QwY0hHamhQZDF3ZHB3UWluLTlqQ3BuVmVCLV9kTQ?oc=5,Armac (ARML3) conclui aquisição da Braslift financenews.com.br,positivo,m&a_estrategia,2,"Armac (ARML3) concluiu a aquisição da Braslift, consolidando operação de fusão e aquisição estratégica que expande seu portfólio operacional."
Armac,ARML3,2025-12-26T08:00:00+00:00,Google News,noticia,Armac (ARML3) anuncia pagamento de dividendo e JCP - financenews.com.br,https://news.google.com/rss/articles/CBMijwFBVV95cUxPNk5hdWliRFhpNDhWQTEyYjloWGI1eEdGTTNnd1JRck44NkZVbDNQUXo3SHdRempFZjhHWi1HbmtYYVpkTDNXcFI5SEhxY3FlUVZiYTRUeGQ5c0tabC1TVUdtWkdyVVU5SkpzMjFZTXJBVXRTYUdGUVktY2lsdktNemNIUFNEa1dsdm8wMXdjUQ?oc=5,Armac (ARML3) anuncia pagamento de dividendo e JCP financenews.com.br,positivo,liquidez_refinanciamento,1,"Armac (ARML3) anuncia pagamento de dividendo e Juros sobre Capital Próprio (JCP), distribuindo recursos aos acionistas."
Armac,ARML3,2025-10-14T07:00:00+00:00,Google News,noticia,"Rápidas: Vale, Petrobras, Bradesco, Santander Brasil, Armac, Even, Banco Pan, Embraer - financenews.com.br",https://news.google.com/rss/articles/CBMiswFBVV95cUxOZmN6WEEyWVcyYWE1WnE0M25QVm84a2VVeEtIVDZXeEwzZEFFVGNSeU01eWVSNXZURVY4bk5UbzFwN3k5Und1UHFqSzVmNEdoWHBUdkNBenIyZzRzS1dnVHpCWGtjVzBEOUlONDByWXEwaWw5YUxwa1V5N1BlY0RLc1ZSclZlMk1MU3o5SnIyNGJrZUdLejFyenNVSUVsR25ieDJfRG1aUlkyek9EN2RtQ0lKWQ?oc=5,"Rápidas: Vale, Petrobras, Bradesco, Santander Brasil, Armac, Even, Banco Pan, Embraer financenews.com.br",neutro,setor_macro,1,"Compilado de notícias rápidas envolvendo empresas Vale, Petrobras, Bradesco, Santander Brasil, Armac, Even, Banco Pan e Embraer. Sem detalhes específicos de eventos ou dados quantitativos disponíveis no trecho."
Armac,ARML3,desconhecida,RI Armac,comunicado_oficial,Central de Resultados,https://ri.armac.com.br/informacoes-financeiras/central-de-resultados/,,neutro,resultado_guidance,1,"Notícia refere-se a uma 'Central de Resultados' sem disponibilização de trecho informativo. Não há dados concretos, contexto ou informações quantitativas para análise."
Armac,ARML3,desconhecida,RI Armac,comunicado_oficial,Comunicados e Fatos Relevantes,https://ri.armac.com.br/informacoes-financeiras/comunicados-e-fatos-relevantes/,,neutro,governanca,1,Comunicado sobre fatos relevantes sem conteúdo específico fornecido. Impossível classificar materialmente sem informações detalhadas no trecho.
Armac,ARML3,desconhecida,RI Armac,comunicado_oficial,Dividendos e JSCP,https://ri.armac.com.br/informacoes-financeiras/dividendos-e-jcp-2/,,neutro,resultado_guidance,1,Notícia sobre dividendos e JSCP sem conteúdo disponível para análise. Impossível classificar sem dados concretos do evento.
Armac,ARML3,desconhecida,RI Armac,comunicado_oficial,Informe de Rendimentos,https://ri.armac.com.br/servicos-aos-investidores/informe-de-rendimentos/,"Os Informes de Rendimento, disponibilizados a todos os acionistas pelo escriturador das ações da Armac, estão disponíveis no Portal de Correspondências Digitais. 1. Acesse https://correspondenciasdigitais.itau.com.br/login, clique em Primeiro Acesso; 2. Digite seu número de CPF e data de nascimento (Pessoa Física) ou CNPJ e data de fundação (Pessoa Jurídica); 3. Escolha a opção para verificar a sua identidade (número de telefone ou e-mail); 4. Digite o código recebido por e-mail e/ou telefone e crie a sua senha pessoal; 5. Pronto, agora basta entrar com o seu CPF/CNPJ e a nova senha cadastrada para acessar os seus documentos. Os Informes de Rendimento estarão disponíveis em “meus informes” – pasta “2024” 4. Selecione o telefone ou e-mail já cadastrado para o envio do código de segurança (token) e clique em “enviar código de segurança”; 6. Crie uma senha, que deve possuir no mínimo 8 (oito) caracteres contendo números e letras, e clique em “próximo”; 7. Ao finalizar, você será redirecionado para a tela inicial do acesso. Os Informes de Rendimento estarão disponíveis em “meus informes” – pasta “2024” Telefone Exclusivo pra Dúvidas de Informe de Rendimentos: 0800-720-5299 (disponível de 01/03 a 31/05)",neutro,governanca,1,"Aviso sobre disponibilização dos Informes de Rendimento 2024 aos acionistas da Armac através do Portal de Correspondências Digitais do Itau, com suporte via telefone 0800-720-5299 de 01/03 a 31/05."
BTG,BPAC11,2026-04-01T19:16:37+00:00,Google News,noticia,Uma construtora virou a queridinha do BTG com chance de subir quase 40%; qual é? - Investidor10,https://news.google.com/rss/articles/CBMivwFBVV95cUxNZXFMRmRsNXlrR3QzWFNDNWFWQ0F2VWEyVGRwLW5NQ1FtT2Z2eTJURWhyYk11TlVqSGIzYXlscTY0Mkc5dHloNC1ORkJEMmRRQjJ5VF82QlZEc0xGMGF1cVdjMnBVRnlxNG5vVTFZbDlwU1RzUnRENDZKY2twaFd6QV9hQUllcHdzZk04ajI4Qk5yWnNNUy05Z0h1cFNsUllnV01hUWZHaDNGQmNPQ01TYkVmRUtXa3ZRclVfampVc9IBxAFBVV95cUxQSEpPZ2RiejUzODdKYnk3VFozODVvOXFxSFFkMmZwWEczb2VZZFlaeGUycjZmVkZxdlRSeWtnYnlKc2dGdkVNWlc5OHJkdU92Qkw1MUJJSWtCSnhYUHN0bnliTl9lUWdHMDlGeWdwZkI3aFBNdVRsUEtqdVhBWlVFWGJxMWVFOTR0UkhxN1JJNDYzQU81bjlZMmF3b3JraklrSzNHZUhBWEdPYU9UTFd1NlhTY0JfNG52WGo1VjMzOXNtUlZJ?oc=5,Uma construtora virou a queridinha do BTG com chance de subir quase 40%; qual é? Investidor10,positivo,m&a_estrategia,1,BTG recomenda uma construtora com potencial de valorização de aproximadamente 40%. A notícia não fornece dados quantitativos específicos sobre a empresa ou fundamentação detalhada da recomendação.
BTG,BPAC11,2026-04-01T20:24:46+00:00,Google News,noticia,Lucro bilionário e ROE elevado: o que esperar de BPAC11 agora? - arevista.com.br,https://news.google.com/rss/articles/CBMilgFBVV95cUxNQnI5UkpVbktXM3hPUXhEbTdnVElOajVNa1NsRDlmSWRfQXBVMGdTZDd0bVVqSV9tOWVzZi1wV0tOUzJaTzlRdkg2ZDREYnA1aUR5blBWUVl4RmNfRWpnWnVQU2hvOWNoTUd2a19KZ2pNU09zNExjbW1TeUtuY0k3bkVrZVFGY1o0eGVMUzFBQzRWYlZackE?oc=5,Lucro bilionário e ROE elevado: o que esperar de BPAC11 agora? arevista.com.br,positivo,resultado_guidance,2,BPAC11 apresentou lucro bilionário e ROE elevado em seus resultados. A notícia questiona quais são as perspectivas para a ação dado esse desempenho.
BTG,BPAC11,2026-02-09T08:00:00+00:00,Google News,noticia,BTG Pactual (BPAC11) 4T25: mais um trimestre de recordes e consolidação estratégica - InvesTalk,https://news.google.com/rss/articles/CBMiY0FVX3lxTE0zcE44UG9LRzl0bVRsaFdOWTRmdlJPZTJDM3RrYUJXczNUREo0YTdQd1lGU1U4eldfV3BQcmcxYjF1MzdEN3VBVmxXZEVRTXM5eWx5RWY0UUFCTlZfQ2c0N0gzcw?oc=5,BTG Pactual (BPAC11) 4T25: mais um trimestre de recordes e consolidação estratégica InvesTalk,positivo,resultado_guidance;m&a_estrategia,2,"BTG Pactual registrou mais um trimestre com recordes no 4T25 e consolidou sua estratégia. O texto não detalha valores específicos, volumes ou métricas quantitativas dos resultados."
BTG,BPAC11,2026-03-22T07:00:00+00:00,Google News,noticia,BTG Pactual é alvo de ataque hacker e suspende operações via Pix - InfoMoney,https://news.google.com/rss/articles/CBMipgFBVV95cUxNZ3ViSVdodHNCZHVWMDRjTk1VLUJEamdQbEY1cktBc3htOWJ2cEhMSkhxN293MFVpY3NHUWhMbGtVZkdpWFpaU2hkQ1hhel9SU0NRYTJKd3BGRDcwV1pEWGV3Uy1XdG41QU5YVTNyVzFsSjM2TnEyamt3b3dIVTNTOGxfTEpsbkdDUHhlRjVsTmZ3NVh5MjBFemVSY2VUQjdwWDNNQ1FR0gGrAUFVX3lxTE5NZGlMUzR3TklMSGZnemlYOUZZNV9HWnFLRWNYRUJKemVjb2FacUF0bkJ3bmM2bC1XWE1vNUY5X19YTFh3Tllza2R6NFhBek5QZ0RKamlBcmtkWHJXbXc5RkVyUGpJNVNYb2IwYUZNMTNid0Y1bWJrZVVDU2U2cU04LUFiVHdNSHhtQzMzc3lYbE9nLTRtbjYxRVdoQW5qbDducDZMemtObVVJMA?oc=5,BTG Pactual é alvo de ataque hacker e suspende operações via Pix InfoMoney,negativo,operacional_incidente;esg_reputacional,3,BTG Pactual sofreu ataque hacker e suspendeu operações via Pix. O incidente afeta a disponibilidade de serviços críticos da instituição financeira.
BTG,BPAC11,2026-02-09T08:00:00+00:00,Google News,noticia,"Mesmo após lucro recorde, BTG Pactual (BPAC11) recua mais de 2%; entenda - suno.com.br",https://news.google.com/rss/articles/CBMimwFBVV95cUxQRWo1TENpRnltQ19rcmVkRk13bDNCSkVpblZiZUtvUjJ6TjFtSGtDOXBQN2RrNDZrbU9SaVlQSkZNOEpQN0RUeHlPTjZXWFpUc01FQm9qSUotSnlXbTNjS1RFMnBqVU56M3hFR1dCTjJoUUtsdlRmTTJHSjEyRUgtOUV1OUxzN3c5VHR5SWkzUURMeG0wZ1VDcWNBRdIBoAFBVV95cUxOblk2WTNkLVpJSGJPRGxSQTN1YWFYbnZvVDhhN2RHb1BJWmhmSDZKV2hwN3B5ZFBMamZzVFhKV1pTTDNWYXFIeXlUZDI4SjZSU0hqa1NVUjdUaVFUNkNZV1FubXlyVTVMLWFybDNmV3l0MXFaS09PTFFFa1Q1NjFwUFhFc3RPeFNFNG1vamx0Z2VjMzZFdmlkWGVmVUh2SG45?oc=5,"Mesmo após lucro recorde, BTG Pactual (BPAC11) recua mais de 2%; entenda suno.com.br",negativo,resultado_guidance,1,"BTG Pactual registrou lucro recorde, mas suas ações (BPAC11) recuaram mais de 2% no mercado, sugerindo reação negativa dos investidores apesar do resultado positivo."
BTG,BPAC11,2026-02-09T08:00:00+00:00,Google News,noticia,Papéis do BTG Pactual (BPAC11) caem firme após balanço não surpreender - Valor Investe,https://news.google.com/rss/articles/CBMiwwFBVV95cUxOSm81VWxvYk1LU0Qxd0tqbC01ZC1KQnMycHBhNm5VZTRDZm00ZnRVMjVNRTFIanlMNGl0cEdocHRFNFIweTNINkFEX0FlZmxpZWdlakpseWJnc2JQbThBSWZsdTZZdzJrV0ZoNUktRGRneEVlMW5RZ2FIeG9VR2ZMNHQ2LVJhRmJmd1lZYXpjZTFabXVBNllGUlZHeFBpdm5fZDlCa3pFN3hYYjFTaE9NNFlZV0JNd3RIVGxUeHRCOU1ITU3SAdIBQVVfeXFMUHhzS0ctX1Fxa3dYQlBZYnhXOW55V3lmY3RWNFFTVlhGVkstRlNPNGVuR3NGYXZzMWZFQTh6WHdYakY3aFFueUJPaUVWeGloR2JzaDdFdE9vdzB2WWU0S3Z6VHBPenM1SmNGdk1fcTBlTzA5My05YjZVZ0hWemZBcmtoUnZFYldPZDJyakMyYmZFQmpUQ3JrTVdobVBfeWhvb0Y0WUFwcGpuZnBwVWNSS3Z4RWFCdTQ3V2dhLTg1VUtOXzFtalZyVWRQc3hzeEU3V2Z3?oc=5,Papéis do BTG Pactual (BPAC11) caem firme após balanço não surpreender Valor Investe,negativo,resultado_guidance,2,"Ações do BTG Pactual (BPAC11) caem após divulgação de balanço que não apresentou surpresas positivas. O resultado não atendeu às expectativas do mercado, impactando negativamente o preço dos papéis."
BTG,BPAC11,2026-02-09T08:00:00+00:00,Google News,noticia,BTG Pactual entrega forte crescimento de lucro e ROE no 4T25 - Nord Investimentos,https://news.google.com/rss/articles/CBMigwFBVV95cUxPSHYxX2F1MlhEal9JUHBIMUdlZ1NuXzFpRWh5QkYwU2t4bEgzOHB1VWdVeUdHSUhwR0ZoZU43U0pIdzZKdWpfb0VTVkk2TmlFRDBjWmE4dFVsbV83U2E1cUllZWV3X3NPNzA3YWx3YllmblREOEg3QTFxVEdpekJFaHZFc9IBiAFBVV95cUxPaENOMEJGN2FzblRrVW9oVFNzR081bmZlcVcxMXpzV1RIVTBNNWM3ZlA0UGtoTVl6elBOd1hHWTEydnZlUDJPWkVYTi1vQ1VLQ3lNbEhTS0g2VElLcF9NTWNLWTRYZ1N5Q3drSlRadldJbVdMYjZWb2ZodVpYUDBHeUw5S1R2LTNz?oc=5,BTG Pactual entrega forte crescimento de lucro e ROE no 4T25 Nord Investimentos,positivo,resultado_guidance,2,BTG Pactual apresentou forte crescimento de lucro e ROE no 4T25. A notícia indica desempenho positivo nos resultados do quarto trimestre de 2025.
BTG,BPAC11,2026-02-09T08:00:00+00:00,Google News,noticia,BTG Pactual (BPAC11) bate novo recorde de lucro e deixa os rivais para trás na corrida da rentabilidade no 4T25 - Seu Dinheiro,https://news.google.com/rss/articles/CBMirAFBVV95cUxNbnVzTm1jWjhORUZWQXpHTmdPQWZPVnJDcGNNR0o3dEZwdXBienJ4Yi11SEpVMkQzdnZMSkVqd25KRzVpb1IwQ05pSncxWHpQcWIwakh1WkY4Rms5MUVnYmJSazRQNkp4dWVXVHVMTmkxX3NSQzFfZlJLR2dqVVlQZEJ1UURkeDJFdWhKTk1fTmZkOFFXQzFiOHZHUGZoWGs1bkhwbC0tR0dXbC1H?oc=5,BTG Pactual (BPAC11) bate novo recorde de lucro e deixa os rivais para trás na corrida da rentabilidade no 4T25 Seu Dinheiro,positivo,resultado_guidance,2,"BTG Pactual atingiu novo recorde de lucro no 4T25, superando a rentabilidade de seus rivais no período."
BTG,BPAC11,2026-03-17T12:21:00+00:00,Google News,noticia,Alerta Estratégia Radar | Swing Trade Venda BTG Pactual (BPAC11) – Stop gain - 17/3/2026 - InvesTalk,https://news.google.com/rss/articles/CBMidEFVX3lxTFAwVXV1ZWt2M1o1dk02cENJZ0VwVloyN3hPeUNBUXVlZUFSUzEwNzZZS3BVc3M4LU42dlJlWHFZOV9EdDNKU0tYdEZYT3BVMHBPWDk2SHh3OUtXcnZybWx5c0JJT1Z3eVd5UU1XbkRrZzVSblZj?oc=5,Alerta Estratégia Radar | Swing Trade Venda BTG Pactual (BPAC11) – Stop gain - 17/3/2026 InvesTalk,neutro,setor_macro,1,"Alerta de swing trade de venda para a ação BPAC11 (BTG Pactual) com stop gain programado para 17 de março de 2026, conforme estratégia Radar da InvesTalk."
