empresa,ticker,data_publicacao,fonte,tipo,titulo,url,snippet_ou_trecho,sentimento,tags,severidade,resumo_curto
PetroReconcavo,RECV3,2025-10-08T07:00:00+00:00,Google News,noticia,O que trava a produção da PetroRecôncavo? Analistas soam alerta após 5 meses de queda - InfoMoney,https://news.google.com/rss/articles/CBMiwAFBVV95cUxORlNvRkhfcUtaTlUzY2xqbVpqeXRtR3d6ZnBKREFmdlUtNTRfUVNNWkNVLXJKc0dfWE54U3JkbExfOUV3VkJ3ZS16MFlMVTVRUnhPVm16ODQ2SExmbTBjY2VnMlVkSHUxRk5BdUZuWHlxb19lenVxNGRsUWxKbk16dFNJaE1kS29JMlRFcnY0UHZfajVCSmdOQ29QYWcwZ2tVRVZlWEg1OFFaMk8zNnZERUkzNVQ1MktYNnplbkliYzjSAcYBQVVfeXFMTUYybFE1Nm56X0lfTXRadTBjaUQwYkhpVU1ZZ3ZSVFFKQ1A1Vi1oWGp6cElqSWI2MVdzc2NnbUl3V3MwY3kta3lIMU1aQWZPSTQwckRhRGlHN1JSdEtHc2h6aUs3Y3k1amxLRXpHOFM0ZjJnQ0EyZ1dLOGx4SGx4dVp2a3YxNGtwd0xLWlFMd2p6Rm9zc0FSeXFSakR4VFppbVBNeDlKa1pvQjB2ek01VmtsNnVuUDc2bE5IVDNKdFZFSGFWZkxB?oc=5,O que trava a produção da PetroRecôncavo? Analistas soam alerta após 5 meses de queda InfoMoney,negativo,operacional_incidente,2,"PetroRecôncavo enfrenta queda contínua na produção há 5 meses consecutivos, gerando alertas entre analistas sobre possíveis gargalos operacionais."
PetroReconcavo,RECV3,2026-01-23T08:00:00+00:00,Google News,noticia,"PetroRecôncavo cai, após Goldman Sachs rebaixar ação para venda e apontar crescimento limitado - ADVFN",https://news.google.com/rss/articles/CBMiakFVX3lxTE1qSkl0NXhjR3doRGN2bGFla1hlSnhuNmQ1V3B0bk5wRlVYTG44UkduZ0NINDhFNDdOc1Z0bEtaWnNmUzZJM0NBdHVTVC1hMEdHMzVDSEliWjBBZ2ZRTkgxMlRzNjBlTURqaWc?oc=5,"PetroRecôncavo cai, após Goldman Sachs rebaixar ação para venda e apontar crescimento limitado ADVFN",negativo,resultado_guidance;setor_macro,2,"Goldman Sachs rebaixou a ação da PetroRecôncavo para venda, apontando crescimento limitado, resultando em queda do preço das ações."
PetroReconcavo,RECV3,2025-12-18T08:00:00+00:00,Google News,noticia,"Bradesco (BBDC4), Cemig (CMIG4), PetroRecôncavo (RECV3), Cogna (COGN3) e Tenda (TEND3) pagam R$ 5 bilhões em proventos; Itaú (ITUB4) anuncia bônus em ações - Seu Dinheiro",https://news.google.com/rss/articles/CBMilAJBVV95cUxOSGZHQllaSlRsd1lOaXZWdlljSnl0WTVXVjI1eG5fLVZKVnktUFNsX3JaMWJVX01jS0xrSXlKbTgtenRpWW82T25VQ3dBRmp0WUxYS3BubE9LNGRRYzBzRFJUd21acmRkb1RpaTVsYUt1enJpWTFSZ2EzQWpvM0ZBdnhaNXpBQl9WSllqa2xicnk0ZUJoMEVhX0ZoTXV5c281UFhIbzA3RnJ1U3ZnRjlySm1kSWt3aC1iYkFnZFdLMmFEN0NDSU5Yb0ZaQVN3S3NlcmEzU0RER0hSdExKRHlWaG1lbTRDY0RKVWpWUFhVbmpoMFQyRjI2R0E5YkEzcGNkbDFrWFlUdmExcm5ndk9EanBaa08?oc=5,"Bradesco (BBDC4), Cemig (CMIG4), PetroRecôncavo (RECV3), Cogna (COGN3) e Tenda (TEND3) pagam R$ 5 bilhões em proventos; Itaú (ITUB4) anuncia bônus em ações Seu Dinheiro",positivo,liquidez_refinanciamento,1,"Bradesco, Cemig, PetroRecôncavo, Cogna e Tenda pagam R$ 5 bilhões em proventos. Itaú anuncia bônus em ações aos acionistas."
PetroReconcavo,RECV3,2025-10-08T07:00:00+00:00,Google News,noticia,"A dificuldade da PetroReconcavo (RECV3) com a produção, segundo analistas - Money Times",https://news.google.com/rss/articles/CBMiowFBVV95cUxNQ1JZM05XaU5neXNNZDBhTTg2OHdQNFlobEQzb2cxRFMtbkVONWtodno3cURUbWU4M1RMSGRIMTBqT1VoSGd3MG1KT3FMTjV5SHp1Y05MQVdBUHd3aXNYdFEwZzhFRHVpWVN0SENSZm5XeXZ1aklOUmROdW8wV3RJSHVkejlyc0JGMnlaZVVqQ3NReTFyaDhVbFlnVXRUaWhDeVlr?oc=5,"A dificuldade da PetroReconcavo (RECV3) com a produção, segundo analistas Money Times",negativo,operacional_incidente,2,"PetroReconcavo (RECV3) enfrenta dificuldades com a produção, conforme apontado por analistas. A notícia indica desafios operacionais na companhia."
PetroReconcavo,RECV3,2026-01-09T08:00:00+00:00,Google News,noticia,"PetroRecôncavo registra leve queda na produção em dezembro, mas fecha 2025 com crescimento anual - ADVFN",https://news.google.com/rss/articles/CBMiakFVX3lxTE52YUJERVlramV2RjZFZ0JmRnpFWlRyUTZyUTREZm1UTW0tVndUeVhQMFVpbDhoZXdEU3hPLVkyRlExWHN1QVZjaFFCT1RNLXF2UnRqWWVfS2dzOWQ3NjV6V3JkYlhpQUZLX1E?oc=5,"PetroRecôncavo registra leve queda na produção em dezembro, mas fecha 2025 com crescimento anual ADVFN",positivo,resultado_guidance;operacional_incidente,2,"PetroRecôncavo registrou leve queda na produção em dezembro, mas apresentou crescimento anual ao fechar 2025. O resultado positivo no período anual compensa a redução pontual do último mês."
PetroReconcavo,RECV3,2025-11-10T08:00:00+00:00,Google News,noticia,Dividendos da PetroReconcavo (RECV3): Diretor diz se empresa pode se tornar grande pagadora - Money Times,https://news.google.com/rss/articles/CBMiwgFBVV95cUxNU0dsOXNjdWNPYUx5TU9iQkFUaGVPN0pfY2lFanFHNmpwVmx6NldRdmlQd24xV1JIUEJQU1lZMzlGanZIQ3c5WUFBVFpBZlZWc2FOQ19DMkxFR3NtU1ZMUEszanVWTjUtamJicV82RnJRc2pyeHZWYnB2MThUM19CeG9CWGxEY0ZtTDk4MGtYcVlFblptQURqWGFoUEhFSkY0TFF2b0tPcm5heERFU002N2tlbnlYTEhFZG8tTUs4eFU5dw?oc=5,Dividendos da PetroReconcavo (RECV3): Diretor diz se empresa pode se tornar grande pagadora Money Times,neutro,resultado_guidance,1,Matéria sobre dividendos da PetroReconcavo (RECV3) que traz declaração de diretor sobre potencial da empresa se tornar grande pagadora de dividendos. Sem dados quantitativos específicos fornecidos no trecho.
PetroReconcavo,RECV3,2025-10-07T07:00:00+00:00,Google News,noticia,"PetroReconcavo (RECV3): Produção cai a 25,9 mil boe/dia em setembro - Money Times",https://news.google.com/rss/articles/CBMiekFVX3lxTFBOSmtKbVJfbjNyQTJOb25WZE44WlhzVGN4V3llUHBzWWVJem44NFRKSnBTc1NPMWpDVEpYbUczZHM4VVlxR1pSbFBVRG5hUGZjMUdFOWVYR1ZORUp4LWcycmZNb3lIaHNSVDZFdkM0OHpDZDB6U2ZwbGJ3?oc=5,"PetroReconcavo (RECV3): Produção cai a 25,9 mil boe/dia em setembro Money Times",negativo,operacional_incidente,2,"A produção da PetroReconcavo caiu para 25,9 mil boe/dia em setembro. A redução na produção é um indicador operacional negativo para a empresa."
PetroReconcavo,RECV3,2025-11-07T08:00:00+00:00,Google News,noticia,PetroReconcavo (RECV3) alcança R$ 122 milhões em lucro no 3º trimestre; veja os detalhes - Estadão E-Investidor,https://news.google.com/rss/articles/CBMikwFBVV95cUxPenBuNDFoaU56WVRfQ0xTeUpxZGQzZmFBS0kyQW5CaTM3R1VDeHJhZFdGVVVzZjZiOGNUamNRbkJLd0ltbmJoT2o5eVV6OGtXWXZqSkU5NWxieGRKaVJ3RmpHc3pJdlJmd1BjamtHUlJHZWF4RkEyYzRQaXNiQUhqTHRfTzhjcEprZElNYi13LV9kT3fSAZgBQVVfeXFMUDZ0ZWJDYkVPc2paZkRvbVpKOFRfTFpHLUd2QXFuVFRLcU1ZbzRNajRpclJqX180UmRsZzZaWGpvVkxWU0xXOTZxT2I3NnN2Z3lmb0NVZk9KWWpRWGVrYjZ0TW1iSXQyeVRSZzgzLThtS0FKXzZMMmFMSE9IVUJnMm5oV3ZrQUlLdnB0dDdzQ1V5WERhTjdWLVo?oc=5,PetroReconcavo (RECV3) alcança R$ 122 milhões em lucro no 3º trimestre; veja os detalhes Estadão E-Investidor,positivo,resultado_guidance,2,"PetroReconcavo (RECV3) reportou lucro de R$ 122 milhões no terceiro trimestre, indicando desempenho financeiro positivo no período."
PetroReconcavo,RECV3,2025-11-06T08:00:00+00:00,Google News,noticia,"Lucro da PetroRecôncavo (RECV3) cai 23% no 3º tri, para R$ 122 milhões - Valor Investe",https://news.google.com/rss/articles/CBMiwAFBVV95cUxOWVA4WUF4Z2JzeDF1MXVHTnZUeE1laHZfWEZLckhyMXBOcTJoUVF1dXJrR0Eyb2wyVGtpVmZxaUp1Yld4V1JKU19nczUzMUhGRXdXTE44WFhOaWxGQW9qcFlQM1UzX2RKRHpTVjVzbzJvRFAzSHo2N2lJOEZUWVdyZVMtWjhGdFFOQVFpdWY4b0ppSzg5R3NxODhqeDFoLUl3Vm8tbUVueTFndjZ3Q20yTzRYcHhZSEpET0xieEd5bGfSAc8BQVVfeXFMTW10ZWxaYjdUVkszZmpaMmxIcTU3NVZRVFA2UTNYajM0RlFNU01zN2U0YTNSY3ZaRjlxS1VSUEJRaWVIcFNKTk9FeXkzOHNmQ1VZNldhWjFVeFNkSlVEeHVPblVlLWIxSlA4ZWJOc3dlamlFSnd0WFU4dHRLQXVwcGQtMkxSdjdiOXNGWnJpOThJV3EtYXk0RW81TExvU0V4Nm9VUnFLVkZpQ2FoS1BZQ3NaM2pPblNVNHZyUFRpa2ctYjVpYUdUMTU4RzhIdDJr?oc=5,"Lucro da PetroRecôncavo (RECV3) cai 23% no 3º tri, para R$ 122 milhões Valor Investe",negativo,resultado_guidance,2,"PetroRecôncavo (RECV3) reportou queda de 23% no lucro do 3º trimestre, atingindo R$ 122 milhões. A redução significativa no resultado da empresa merece acompanhamento."
PetroReconcavo,RECV3,2026-01-13T08:00:00+00:00,Google News,noticia,"Day trade: Compre Brava Energia (BRAV3) e PetroReconcavo (RECV3) para ganhar até 1,43% nesta terça (13), segundo a Ágora - Money Times",https://news.google.com/rss/articles/CBMi0wFBVV95cUxORS1NRF9GZk9hQUsxSEVtRF9VdUN0OGVxd2FUeWJxZVBwSDVicTFVUTNVUGdJTjc5WjdNZzBEVW1TeVNYRnZfX0N5Q0N1SWdOVHAzRVFGQlVkUnlTZXBzakNOMm5YODktekVkcjRkRmUyT3lBWG53cFQzWkxPUk1xNDZBanRfSm1TSlg5M0c1U016UHVZbUdrTktYODY3QzJVYjJic0JUaXduZzVSSG9KX0xua3d0MC04cmhxTXk0N04zeFlTd2hZTDBvOGU2cUExT1Rn?oc=5,"Day trade: Compre Brava Energia (BRAV3) e PetroReconcavo (RECV3) para ganhar até 1,43% nesta terça (13), segundo a Ágora Money Times",positivo,setor_macro,1,"Recomendação de day trade para compra das ações BRAV3 (Brava Energia) e RECV3 (PetroReconcavo) com potencial de ganho de até 1,43% no dia 13, conforme análise da Ágora."
PetroReconcavo,RECV3,2026-01-09T08:00:00+00:00,Google News,noticia,"PetroRecôncavo (RECV3) registra queda de 0,7% na produção - Economic News Brasil",https://news.google.com/rss/articles/CBMilAFBVV95cUxOVGY1NlNRN3BsQS1TWGhvOGJOdXpxeEpUdnpKT09ZSHdDS1FsM3ppSGdJMzNTYjRpMlkwblJWeEhtVW5QSmYyOUlSVm9JUXd5OGtqMXpOUm1peFRIR1ZaczVNdlQtcG92Rldoa0ZTcXp3WDMyYnl3bG54TnUza0JDdHhFZVg3TlIxQ0tfRlRHWE1UQTB0?oc=5,"PetroRecôncavo (RECV3) registra queda de 0,7% na produção Economic News Brasil",negativo,operacional_incidente,1,"PetroRecôncavo (RECV3) registrou queda de 0,7% na produção. A redução é marginal e não representa impacto significativo nos indicadores operacionais da companhia."
PetroReconcavo,RECV3,2025-12-19T08:00:00+00:00,Google News,noticia,PetroReconcavo aprova R$ 300 milhões em dividendos e reforça previsibilidade ao investidor da B3 - ADVFN,https://news.google.com/rss/articles/CBMiywFBVV95cUxQWVZITXh4ZlJhZDVUZGxNTkRFNXRBS2lDbnlaZE9TQzBDSEg4Yk05bzFGRDZlb0l4WndwRVhoQnd4MUV0c2lZZUl2aXdjT3lfaE9XbGNYaHR6QjgxdEU2NTk3MUFLX0NxWU1oUlFxZHk4b1lDTjBCVEZYejVxYndNOFJOZHhocXdTRGZNclBBdUtldFE1OG5qbWRGX0NLekdnMGFzcFpFYTBFbXYxQWNsV3lLVXdodllfbnpLOFVpWXNGLTlFUm5QRmFubw?oc=5,PetroReconcavo aprova R$ 300 milhões em dividendos e reforça previsibilidade ao investidor da B3 ADVFN,positivo,liquidez_refinanciamento;governanca,2,PetroReconcavo aprova distribuição de R$ 300 milhões em dividendos aos acionistas. A aprovação reforça a previsibilidade para investidores da B3.
PetroReconcavo,RECV3,2026-01-29T08:00:00+00:00,Google News,noticia,PetroReconcavo aprova reestruturação da diretoria após renúncia de diretor - InfoMoney,https://news.google.com/rss/articles/CBMiswFBVV95cUxOMzlXMjlRaV9TNnVFZVFiM3M4dDRFZ24wMGZGWU4xWGxDRXVZOUk0aUEzczF6c29JVVdOd2ZVV0RtZ3FOT1VQdHAyUDA1ejVBWjdOX1dwbGJ5QWk5UUFOZ0tYakYxYS1XY1Q5em9yS2lnSWtaSS02WV9kcU5HVUhDaHQxLVZiRlFyMDlaRXQ3VXBtTFNsU2tSNkFPdmppTnR5QmdYLVBhcmtpdVQ0MlFwb2FGa9IBuAFBVV95cUxQRmRLc1hlVFhvNlFZbkx6WkVMZHlHTS1xYXQtdjNLaVhER1pmV1BMbktBV0s4Nm5RUF9KLUM1QVFXb0pkblRKVUhpSHVNRFhIejVWUHpXWF9JYnlWOEJLSWg2SmlSV2Q2NThwN3dmSXpULVJNcjVMRjJoMUt2dGNudld5al8zUWJKOWFQWHlVS2xUQ05FMnlRMmhJYVNuUmVKMzRrVlFiZmlsZGtwcTRZaWQzT1pNcngz?oc=5,PetroReconcavo aprova reestruturação da diretoria após renúncia de diretor InfoMoney,neutro,governanca,2,PetroReconcavo aprovou uma reestruturação de sua diretoria seguida à renúncia de um diretor. A notícia relata a ação administrativa sem detalhar impactos específicos ou dados quantitativos.
PetroReconcavo,RECV3,2025-12-06T08:00:00+00:00,Google News,noticia,"PetroReconcavo (RECV3) avança e bate 25,1 mil barris por dia - BPMoney",https://news.google.com/rss/articles/CBMikwFBVV95cUxNYXFqRTYzMFVtUjBUcURLU2ZTYzhkQjNXcjFidVQ4dnJDSW1xM21tYmlMQW1BeEVGS3YySlloc09SUzJxN0wzR0xRQ1NUcTE2UmNMRVJHLWl4NVQtbEFZM1FxQ01GNFJDOEJjejctQmRiSDRqNDQ3RURCQzhzTF9MV3pmUXVDTFRWT29aN0VXVmo4MGc?oc=5,"PetroReconcavo (RECV3) avança e bate 25,1 mil barris por dia BPMoney",positivo,operacional_incidente,2,"PetroReconcavo (RECV3) atingiu produção de 25,1 mil barris por dia, evidenciando avanço operacional."
PetroReconcavo,RECV3,2026-01-08T08:00:00+00:00,Google News,noticia,"PetroReconcavo (RECV3) tem queda mensal na produção em dezembro, mas fecha 2025 com alta anual - TradingView",https://news.google.com/rss/articles/CBMia0FVX3lxTE1haWZ6VzA5aU5FRXYzSmEzMGt3T0JvY0JRNTA0Z2dYOTVkd2NueVNUT0EwUl96MFdWU29kUTAyTWpBbzFkVkpKODFnUXhXR1FiLU90LVRoNTZORHRzMWxpdWNyalZ6enRWRW53?oc=5,"PetroReconcavo (RECV3) tem queda mensal na produção em dezembro, mas fecha 2025 com alta anual TradingView",neutro,operacional_incidente;resultado_guidance,1,"PetroReconcavo registrou queda na produção em dezembro, mas apresentou alta anual ao fechar 2025. O resultado misto reflete volatilidade mensal com recuperação no acumulado do ano."
PetroReconcavo,RECV3,2026-03-11T07:00:00+00:00,Google News,noticia,Petrobras (PETR3; PETR4) sobe mais de 4% com petróleo em alta e impulsiona Ibovespa - Estadão E-Investidor,https://news.google.com/rss/articles/CBMisAFBVV95cUxNVlBtQ050eERDNXA3dnA2dlR5Y3k2UkY4N19faG1SbVVaMzhISmxZREZqbUJSeHJNVXZxUjdkQlE3d2o2cWRMc0VILThwTnNqbUtJZnIySURWdUZCRU91Rlo0NU1IX3otaksyUzR0LWRQMjVZMktYTnd1aGFaQlZLUzJuRDdXZEthQVNvOHFlUGM5MmRsSTlwSm4xVnd4dnA4ZXI3SE5POXBUa1VyVEpLX9IBtgFBVV95cUxPbWlKWE5Kb0JOSE84cHJ4NnRLQnNYeWZST2Ezc0dVN2xqc1JWcFE3cWI0a0lBWkVnVzN4aUx2MWxQYVRLa2VmUnlmWlZaSFp2djRCNmY2d25fNTNYUl9kMnFtQlNEN3ljRFBtVnFFcGVrOEZ4X0V1blZBbjJYbFRkRFdLeHNNTXZzSFE0WU9QUEFRQ0dFWXZuWVdxTDY0UlJaWHJEaHpxdjZjdXZhVjRqVzAzSHVQQQ?oc=5,Petrobras (PETR3; PETR4) sobe mais de 4% com petróleo em alta e impulsiona Ibovespa Estadão E-Investidor,positivo,setor_macro,1,"Petrobras (PETR3; PETR4) subiu mais de 4% acompanhando a alta internacional do petróleo, contribuindo para ganhos do Ibovespa."
PetroReconcavo,RECV3,2025-10-07T07:00:00+00:00,Google News,noticia,PetroReconcavo (RECV3) registra queda na produção de setembro na comparação mensal - Estadão E-Investidor,https://news.google.com/rss/articles/CBMikgFBVV95cUxQQmJ0UGJZdmh0czliM3ZLdGdVbnZzNkQ1VDFvOTRpUHlWTHJEWnM5dDVpaFc2Z25QN2w4NHpWUEgyWXdkRmNpbzBzTFZhNTFBVFpDcWU4T0c4V1pGS2NHeW5XQmYtMlJteC0wV0c3eEpSNE45V25kY2tKdjhiSUVlbzl0aWo1ZzVvYmJvVXJqUTdMQdIBlwFBVV95cUxNLVE2ZWxfYXBXR1BSaGNpdXgyTmtWZ1pSa0dya1RTVE4tTHRFLWoybVdCWENfdkEtWl93WmxReF9TSEI0dUpSOTVxQXdxNzRLMlFpVGJMSjFWMHozLVhwa0J6MHdtdENpLS1SZ2xmNU1vZ3J4c1VrZ3RKcFJDc3hqYXVCeWFVa0lsbTRrdTdvX2VHVm5PMlBN?oc=5,PetroReconcavo (RECV3) registra queda na produção de setembro na comparação mensal Estadão E-Investidor,negativo,operacional_incidente,2,PetroReconcavo registrou queda na produção de setembro em comparação com o mês anterior. A redução mensal na produção representa um indicador operacional negativo para a companhia.
PetroReconcavo,RECV3,2025-12-12T08:00:00+00:00,Google News,noticia,"Itaú BBA corta preços-alvo de Prio (PRIO3), Brava (BRAV3) e PetroReconcavo (RECV3); veja o que esperar de 2026 - Money Times",https://news.google.com/rss/articles/CBMizgFBVV95cUxQbnVvaXpzSUZNRktRbUQwcm9ubXAwakJWR3MxQTRRaHo5WFZQUmNjZzZBa1EtVFNDVHRoUWEzYVZPclpaRHQwVHZwLXdtcEVFUzZYVkJZR1E4SHVGZzNBU21KTWo4SVRkSElvZUpKVEVrb0lvaVpGcV83Y1RKLS1LTWxpb2hPVEFQN1RjRkRHUlZRWEx3SmkwT19LVEdkUWI4c2g3WlV0QkltNHdSYVVOTl92UHVFa0ktSDU4Vi1haWtOQkZSNWZPclVydk10dw?oc=5,"Itaú BBA corta preços-alvo de Prio (PRIO3), Brava (BRAV3) e PetroReconcavo (RECV3); veja o que esperar de 2026 Money Times",negativo,resultado_guidance;setor_macro,2,"Itaú BBA reduz preços-alvo das ações de três empresas petrolíferas: Prio (PRIO3), Brava (BRAV3) e PetroReconcavo (RECV3). O corte de preços-alvo indica perspectivas menos otimistas para essas companhias em 2026."
PetroReconcavo,RECV3,2025-11-10T08:00:00+00:00,Google News,noticia,'Não acreditamos em uma Petrobras privada no onshore': Diretor da PetroReconcavo (RECV3) afasta tese de consolidação do setor - Money Times,https://news.google.com/rss/articles/CBMi4AFBVV95cUxNd2dZendIczg0emFkTk1hVjQxeUZaMDU0a1V2X2N4b0d5R2NkUENkZThTTkR4d09pcGdaaHo2WDl6ZHZfMVhSMHNUVXNQRG1GMlFxUWwwaGJBc0FnUWVWMi1IS0F2ZGVzbG9XNUdYMFgwVHZ1UnBHS3E2bF9heGdnZFBkSTg5SXBPRlItMU9xOG10ZktVOFdVaFBsYVFwSUEwZk11dXdiYm5JOHdNenYwSU4yakN0RkJmUWpNYV9NLUwtcDlWQXdSaTU3YUhVU2F2VUpJa0xDdGh0SWFPZWlfVw?oc=5,'Não acreditamos em uma Petrobras privada no onshore': Diretor da PetroReconcavo (RECV3) afasta tese de consolidação do setor Money Times,negativo,m&a_estrategia;setor_macro,2,"Diretor da PetroReconcavo (RECV3) afasta a possibilidade de consolidação do setor onshore com uma Petrobras privada, descartando uma tese de integração setorial."
PetroReconcavo,RECV3,2025-10-13T07:00:00+00:00,Google News,noticia,"Petroreconcavo conclui farm-out em sete concessões no Rio Grande do Norte, por US$ 5 milhões - ADVFN",https://news.google.com/rss/articles/CBMixAFBVV95cUxOT0owNjV6b0dINUxDUFdCNGk3NDYzMUJWWnFxaTB5XzVxWkJuRndxMkUwcHpTN2NSdVZsWmtlc3ZBOXBfSUM5eDVQS3pSandxNnlVaTJSVzhmaHZWMTd0VzluQlpiY2VabjFoUFVEQW85OUxoSVpENERkRmVCeTktTzdqakRwMnpMSmwtMVJqdm5LX3JfQkt2SThrNEppNWNFcXFLUXFTX0F5c1gwWDJoSld6VENzY29BRWs1M0E0dlFIc21m?oc=5,"Petroreconcavo conclui farm-out em sete concessões no Rio Grande do Norte, por US$ 5 milhões ADVFN",positivo,m&a_estrategia;liquidez_refinanciamento,2,"Petroreconcavo concluiu operação de farm-out em sete concessões no Rio Grande do Norte por US$ 5 milhões, representando desinvestimento e geração de liquidez."
PetroReconcavo,RECV3,2026-02-20T08:00:00+00:00,Google News,noticia,PetroReconcavo (RECV3) tem fôlego para novo ciclo de alta? - Acionista.com.br,https://news.google.com/rss/articles/CBMiiAFBVV95cUxPQ3JvVERUT2dqTVBMSEdnRzZwaHZ3UFRUdURHRkJuYVlYSkNRNXZFRldJRko5U05TX3Jyci1TRkltMWNfZnZvcUdnWUJGc1FMSm8zZ08xZkxvRHJYaDFvMGpkckRRdkFhTC16T0RUb1FaR1BHWGNncUx2ZEpqTk5fQUpaamlWMUlT?oc=5,PetroReconcavo (RECV3) tem fôlego para novo ciclo de alta? Acionista.com.br,neutro,setor_macro,1,"Artigo especulativo sobre perspectivas futuras da PetroReconcavo (RECV3) em forma de pergunta. Sem dados concretos, valores, resultados ou informações específicas que permitam avaliar o potencial de alta mencionado."
PetroReconcavo,RECV3,2026-02-02T08:00:00+00:00,Google News,noticia,Petrobras (PETR4) e petrolíferas recuam com queda do petróleo no exterior; entenda - suno.com.br,https://news.google.com/rss/articles/CBMikAFBVV95cUxQNVN6YW9tX1c2b2xvQ25PeTdnc25XajBBT21md0xzZ3ByS0JocE11emMzbnhPOWhJb1ZHVlRUQ2ZCbnJlSkdvSkFVdHV4cC1kc2QtakxyQXd5QnlkR2V4YUNtWEhYcjR6ZF9LdVhHeW9lRlpnU204N1k5Tk1LdDZObWNPbEEtMmxpc19YQkVWQTXSAZYBQVVfeXFMTUdPTWxwVXdtcWx4SFhzUmZPNTUxM05UMEstYjFRbFhLUTVrRGF4SEdlUjh3TXdYYWpURldQTm9jRVY0MlZRblJiNVA1TUd2RmpQLVBVR3lxRlAtVGdPbEhCZmpxR05TZmhqaTRQLUlpNGllcEk4WjdyVi02TXIxQTVTMFN4a2x2SDk4RUg5TVNETFFQVGhR?oc=5,Petrobras (PETR4) e petrolíferas recuam com queda do petróleo no exterior; entenda suno.com.br,negativo,setor_macro,2,Petrobras (PETR4) e outras petrolíferas recuam em resposta à queda do preço do petróleo no mercado internacional. O movimento reflete pressão de fatores macroeconômicos externos sobre o setor.
PetroReconcavo,RECV3,desconhecida,RI PetroReconcavo,comunicado_oficial,Informe de Governança,https://ri.petroreconcavo.com.br/informe-de-governança,,neutro,governanca,1,Informe de Governança publicado sem conteúdo disponível para análise. Impossível extrair dados específicos ou avaliar impacto material baseado apenas no título.
PetroReconcavo,RECV3,desconhecida,RI PetroReconcavo,comunicado_oficial,Central de Resultados,https://ri.petroreconcavo.com.br/central-de-resultados,,neutro,resultado_guidance,1,Notícia identificada apenas por título 'Central de Resultados' sem conteúdo textual disponível para análise. Impossível extrair dados concretos ou avaliar impacto específico.
PetroReconcavo,RECV3,desconhecida,RI PetroReconcavo,comunicado_oficial,Debêntures,https://ri.petroreconcavo.com.br/debentures,,neutro,liquidez_refinanciamento,1,Notícia sobre debêntures sem informações adicionais disponíveis no trecho fornecido.
PetroReconcavo,RECV3,desconhecida,RI PetroReconcavo,comunicado_oficial,Dividendos,https://ri.petroreconcavo.com.br/dividendos,"De acordo com o Estatuto Social da PetroReconcavo, 25% do lucro auferido no período deve ser distribuído aos acionistas. A Companhia tem apresentado um histórico de pagamento de dividendos acima da remuneração mínima prevista em seu Estatuto, aderente às melhores práticas de governança corporativa e a sua estratégia corporativa, mantendo o compromisso de realizar uma alocação de capital estratégica de maneira a fomentar o crescimento saudável de seus negócios, remunerando seus acionistas de maneira equilibrada durante esse processo.",positivo,governanca,2,"PetroReconcavo distribui dividendos acima do mínimo obrigatório de 25% do lucro conforme Estatuto Social, demonstrando compromisso com remuneração equilibrada aos acionistas e aderência às melhores práticas de governança corporativa."
PetroReconcavo,RECV3,desconhecida,RI PetroReconcavo,comunicado_oficial,Atas e Assembleias,https://ri.petroreconcavo.com.br/atas-e-assembleias,,neutro,governanca,1,Notícia refere-se a atas e assembleias sem conteúdo específico disponível para análise. Impossível extrair informações concretas ou avaliar impacto material.
PetroReconcavo,RECV3,desconhecida,RI PetroReconcavo,comunicado_oficial,"Fatos Relevantes, Comunicados e Avisos",https://ri.petroreconcavo.com.br/fatos-relevantes-comunicados-e-avisos,,neutro,governanca,1,Documento contém apenas título genérico de divulgação corporativa sem conteúdo específico. Impossível avaliar o evento sem informações substantivas.
PetroReconcavo,RECV3,desconhecida,RI PetroReconcavo,comunicado_oficial,Relatório de Sustentabilidade,https://ri.petroreconcavo.com.br/relatorio-de-sustentabilidade,,neutro,esg_reputacional,1,Publicação de um Relatório de Sustentabilidade. Sem dados específicos disponíveis no trecho para análise de impacto.
PetroReconcavo,RECV3,desconhecida,RI PetroReconcavo,comunicado_oficial,09marComunicado de Produção - Fevereiro/2026,https://ri.petroreconcavo.com.br/Download.aspx?Arquivo=CXHxjZg2cRwahoZsnnn4/g==,,neutro,operacional_incidente,1,Comunicado de produção referente a fevereiro de 2026. Sem dados concretos disponíveis no trecho fornecido para análise.
PetroReconcavo,RECV3,desconhecida,RI PetroReconcavo,comunicado_oficial,Relatório de Reservas,https://petroreconcavo.riprisma.com/relatorio-de-reservas,,neutro,liquidez_refinanciamento,1,Notícia sobre Relatório de Reservas sem conteúdo disponível para análise. Impossível classificar com base em dados concretos.
Aegea,AGYS3,desconhecida,RI Aegea,comunicado_oficial,Relatório Anual de Sustentabilidade,https://ri.aegea.com.br/relatorio-anual-de-sustentabilidade/,,neutro,esg_reputacional,1,Publicação de Relatório Anual de Sustentabilidade. Sem dados específicos disponíveis no trecho para análise quantitativa ou qualitativa detalhada.
Aegea,AGYS3,desconhecida,RI Aegea,comunicado_oficial,Outros Relatórios ESG,https://ri.aegea.com.br/esg/outros-relatorios-esg/,,neutro,esg_reputacional,1,Notícia refere-se a relatórios ESG sem detalhes específicos disponibilizados. Impossível avaliar conteúdo ou impacto devido à ausência de trecho informativo.
Aegea,AGYS3,desconhecida,RI Aegea,comunicado_oficial,Central de Resultados,https://ri.aegea.com.br/informacoes-aos-investidores/central-de-resultados/,,neutro,resultado_guidance,1,"Notícia refere-se a uma 'Central de Resultados', porém nenhum trecho ou dado concreto foi fornecido para análise. Impossível classificar o conteúdo específico sem informações detalhadas."
Aegea,AGYS3,desconhecida,RI Aegea,comunicado_oficial,Debêntures/ Companhias Abertas,https://ri.aegea.com.br/#,,neutro,liquidez_refinanciamento,1,Notícia sobre debêntures de companhias abertas. Sem trecho disponível para análise de dados concretos ou eventos específicos.
Aegea,AGYS3,desconhecida,RI Aegea,comunicado_oficial,Release de Resultados,https://api.mziq.com/mzfilemanager/v2/d/9aa4d8c5-604a-4097-acc9-2d8be8f71593/f03332e9-e716-508d-e94c-a9a8b8169954?origin=2,,neutro,resultado_guidance,1,Anúncio de release de resultados sem detalhes específicos fornecidos no trecho. Impossível avaliar impacto sem dados quantitativos ou qualitativos concretos.
Aegea,AGYS3,desconhecida,RI Aegea,comunicado_oficial,Apresentação de Resultados,https://api.mziq.com/mzfilemanager/v2/d/9aa4d8c5-604a-4097-acc9-2d8be8f71593/98174581-584c-7adc-a01e-6a60da3af894?origin=1,,neutro,resultado_guidance,1,"Notícia refere-se a uma apresentação de resultados, mas nenhum dado específico está disponível no trecho fornecido."
Equatorial,EQTL3,2026-03-26T14:07:33+00:00,Google News,noticia,Equatorial (EQTL3) muda política de dividendos e ação cai firme; entenda - Valor Investe,https://news.google.com/rss/articles/CBMi7wFBVV95cUxNMktMZU9UYXVrbkpDeFd5WkU3aGxiczByMGVNMk9lRVFVNjRqR2lvaS1YUkhnd0hVbDJRVG04UWtnNXVHOXpoRFhWQUl1TmozbzNJWktHcloxcXVQdmpDSFpOc0RlZGxlanJXRlVRSXB3VUI4b0tRQ2l2NDFPV1NHaTV0RS15eGlDdm9uTTJjdjJxUThSUFhXUU1FcVAteTR2NEd1MFdjTjN3UmFPbjBDemI0cW94U29EeHp4THJZMnROUW1OMl9SWVRTTTdpcTMwY1d3Y0piakFMTHRIRE5CcXdyOEdmTzU2eGFONlpSRdIB_gFBVV95cUxQNWNSWEFjOEd6SC1rWlJxQ2s1NVRQQ1RJN0dFWG5UdEZINnZJQkx2RWNaSVlCVnBqb09tcWpIOGZaSDZtVmdKMjFBbEhjTlJFZEJna1ZPQmlmOW14WFhObHZHaHl2YTdsLUlFXzhlZkVZaFVucEFMY2s4Wlc0c2FpM3RMS3RtUWxmVGt2YXE5cWpqdXNNU1laU1VPMVJtR3ctN2ZnYWJ3VmREak5kTWxCb3NZclQ3dEdCWUpIVk9qNmpySkpseHhyanNBcWNWTXptS1JrX0pPTUlQS1g2OXR3UnR4bTBKVVdCN2xmaWdRX2tjT1BuQVRsWXRGaE9YUQ?oc=5,Equatorial (EQTL3) muda política de dividendos e ação cai firme; entenda Valor Investe,negativo,governanca;liquidez_refinanciamento,2,"Equatorial (EQTL3) alterou sua política de dividendos, resultando em queda firme do preço da ação. A mudança na política de distribuição de lucros representa uma decisão de governança corporativa que impacta negativamente acionistas."
