empresa,ticker,data_publicacao,fonte,tipo,titulo,url,snippet_ou_trecho,sentimento,tags,severidade,resumo_curto
Copasa,CSMG3,desconhecida,RI Copasa,comunicado_oficial,Informe sobre o Código de Governança,https://ri.copasa.com.br/governanca-corporativa/informe-sobre-o-codigo-de-governanca/,2025: Clique aqui para acessá-lo. 2024: Clique aqui para acessá-lo. 2023: Clique aqui para acessá-lo. 2022: Clique aqui para acessá-lo. 2021: Clique aqui para acessá-lo. 2020: Clique aqui para acessá-lo. 2019: Clique aqui para acessá-lo. 2018: Clique aqui para acessá-lo.,neutro,governanca,1,Disponibilização de links para acesso aos Informes sobre o Código de Governança referentes aos anos de 2018 a 2025. Trata-se de um índice de documentos de governança corporativa sem conteúdo material específico.
Copasa,CSMG3,desconhecida,RI Copasa,comunicado_oficial,Dividendos,https://ri.copasa.com.br/informacoes-financeiras/dividendos/,"A remuneração aos acionistas se dá sob a forma de dividendos e/ou Juros sobre o Capital Próprio (JCP), observando a Política de Dividendos vigente da Companhia. Clique aqui para acessar a Política de Dividendos em vigor (aprovada pela Assembleia Geral realizada em 28/04/2023). A tabela abaixo mostra as distribuições de dividendos/JCP realizadas a partir de 2006: * Períodos com distribuição pro-rata, cujos valores não estão contemplados na tabela. ** Os valores declarados como JCP foram imputados aos dividendos mínimos obrigatórios dos respectivos exercícios. ***Valor Ajustado. A partir de 26/11/2020, as ações passaram a ser negociadas ex-desdobramento. Dessa forma, os proventos anteriores a essa data foram divididos por 3. Para acessar o histórico de dividendos (JCP declarados) em Excel, acesse a Planilha Interativa.",neutro,governanca,1,"A Companhia divulga sua Política de Dividendos aprovada em Assembleia Geral de 28/04/2023, apresentando histórico de distribuições de dividendos e Juros sobre Capital Próprio desde 2006, com ajustes relacionados ao desdobramento de ações ocorrido em 26/11/2020."
Copasa,CSMG3,desconhecida,RI Copasa,comunicado_oficial,Informe de Rendimentos 2025,https://ri.copasa.com.br/informacoes-financeiras/informe-de-rendimentos-2025/,"O acionista deverá acessar o portal digital do Agente Escriturador Bradesco para obter seu Informe de Rendimentos do exercício de 2025, conforme orientações abaixo: Acesse https://documentosdigitaiscustodia.bradesco/ Caso já possua acesso, deverá informar o CPF ou CNPJ, a senha e os caracteres de segurança exibidos na tela. 1. Clicar em “Primeiro Acesso”; 2. Informar o CPF e a data de nascimento (Pessoa Física) ou o CNPJ e a data de fundação (Pessoa Jurídica); 3. Escolher o método de verificação (telefone ou e-mail); 4. Informar o código recebido e criar a senha; 5. Após o cadastro, realizar o login normalmente com o CPF ou CNPJ e a senha criada. Após a conclusão do acesso, o Informe de Rendimentos Financeiros estará disponível no menu “Documentos para Download“. Em caso de dúvidas sobre acesso, alteração de senha, correção de dados inválidos, entre outras, o investidor poderá utilizar o chatbot ou o botão de dúvidas disponíveis no portal. Para investidores correntistas Bradesco, permanece disponível a consulta e a emissão do Informe de Rendimentos diretamente pelo Internet Banking, no caminho: Investimentos > Outros Serviços > Consulta > Ver Informe de Rendimentos – 2ª via. Para mais informações, entre em contato com a equipe de Relações com Investidores: ri.copasa.com.br / ri@copasa.com.br (31)3250-1063 / 1065 / 1386 / 1602 / 1643 / 1861",neutro,operacional_incidente,1,"Comunicado sobre disponibilização do Informe de Rendimentos 2025 através do portal digital do Agente Escriturador Bradesco, com instruções de acesso e alternativas via Internet Banking para correntistas."
Copasa,CSMG3,desconhecida,RI Copasa,comunicado_oficial,Avisos por E-mail(Mailing List),https://ri.copasa.com.br/servicos-aos-investidores/avisos-por-e-mail-mailing-list/,"Cadastre-se para receber, por e-mail, as principais informações divulgadas pela Companhia.",neutro,governanca,1,"A Companhia oferece um serviço de mailing list para que interessados recebam por e-mail as principais informações divulgadas. Trata-se de um canal de comunicação institucional padrão, sem impacto material nos negócios."
Copasa,CSMG3,desconhecida,RI Copasa,comunicado_oficial,Central de Resultados,https://ri.copasa.com.br/servicos-aos-investidores/central-de-resultados/,,neutro,resultado_guidance,1,"Notícia identificada como 'Central de Resultados' sem conteúdo específico disponível para análise. Impossível extrair dados quantitativos, datas ou informações concretas do evento."
Copasa,CSMG3,desconhecida,RI Copasa,comunicado_oficial,Relatório de Sustentabilidade,https://ri.copasa.com.br/servicos-aos-investidores/relatorio-de-sustentabilidade/,2024: Clique aqui para acessá-lo. 2023: Clique aqui para acessá-lo. 2022: Clique aqui para acessá-lo. 2021: Clique aqui para acessá-lo. 2020: Clique aqui para acessá-lo. 2019: Clique aqui para acessá-lo. 2018: Clique aqui para acessá-lo.,neutro,esg_reputacional,1,Disponibilização de Relatórios de Sustentabilidade referentes aos anos 2018 a 2024 através de links para acesso. Trata-se de divulgação de documentação de sustentabilidade sem dados específicos de impacto ou resultados quantificáveis.
Cosan,CSAN3,2026-03-16T07:00:00+00:00,Google News,noticia,Cosan (CSAN3): o que esperar da holding após resultados e reestruturação? - InfoMoney,https://news.google.com/rss/articles/CBMirAFBVV95cUxQRzNxd01GVHB2eDNwRzM1Z1VQWEhiVzg4UGVWQXNBemR3dklKSjBjNlZENTRBTzVmTmRlS1FJdC1ZaG5UNHltRU5KTGo1MElrOVVUYUpTQXRYZE9tVXFZMGNZNDhPWHptTDB3dEgxYnMtVV9HRVJIRHRQU1FpaGRDZ0NjeXF1N3RBWmluWGNTdlRDY2JyZk5SYTlkek5kUjF6UXpEU0ttZ2xyYXd30gGyAUFVX3lxTE55QlVOQmlwZmhTLXhsRGJGTHNwazljdkpsOUkyRGZhU2RQT1cxN1RUQzJDdENBbDhqRzFYMU9sQjh1d0NLRnJnNmhoaTgxMWlHYW5BZ1NBNDFJSW9MbXF5S2RkZHBHYnB3VzV6MDB3MUpwWkFLNm4wbUdmTEVaV1RmR01mTE02b1VZZ2xkaHRKUTFzSV94OEtaci1USm5JTnJvM0I4bnloVkxWczEyV2ZJUXc?oc=5,Cosan (CSAN3): o que esperar da holding após resultados e reestruturação? InfoMoney,neutro,resultado_guidance;m&a_estrategia,2,"Análise sobre perspectivas da holding Cosan (CSAN3) considerando seus resultados recentes e processo de reestruturação em andamento. O texto não apresenta dados quantitativos específicos, apenas questiona as expectativas futuras da empresa."
Cosan,CSAN3,2026-03-29T18:53:12+00:00,Google News,noticia,"Credores avaliam cisão na Raízen (RAIZ4) e exigem aporte maior das controladoras Cosan (CSAN3) e Shell, diz jornal - Seu Dinheiro",https://news.google.com/rss/articles/CBMi5wFBVV95cUxPdE5uSTZNYUkxTlhzTFRVM1BGLWdhSGtQS1QzVDRoN2R4bzRNbkdLZTBraTZCUTJTTXFyZ1dIMzZ5b051MGtMOUlGMDdPYXZOY1YxUHhzd3l1MXZKT0h6LW1JeEJseklzQ2pwVmVSYVZINFVfeUFRdUVocDB2Nk9xUjJKdC1zdzV2WDhKRTcza2lqLVZLam1TTjR6OVpaLTctNFFHRzhJVWVQc1M3T09UTUxzVkZLQjVONVZiZXRKY2dRQmo5eEJUT0xhMjBkTE1ZSWx1LWVna1FOQzB4VnhyVjg4VmNwOVk?oc=5,"Credores avaliam cisão na Raízen (RAIZ4) e exigem aporte maior das controladoras Cosan (CSAN3) e Shell, diz jornal Seu Dinheiro",negativo,liquidez_refinanciamento;m&a_estrategia;governanca,3,Credores da Raízen avaliam cisão da empresa e exigem aporte maior das controladoras Cosan e Shell. Tensão entre credores e acionistas sobre estruturação financeira da operação.
Cosan,CSAN3,2025-12-24T08:00:00+00:00,Google News,noticia,Cosan (CSAN3) vira a página no apagar das luzes de 2025 - suno.com.br,https://news.google.com/rss/articles/CBMigAFBVV95cUxPdU9IcEhoenNuUVN3NFc4MlRnTkhtQzhwcGJXQlNkamd5WHBUbE9tbHpKZzAtX3pzYl9xRFgxMTl5V2l5MDZhOTIzbER6WUZjRV9ONVQ2QmVxbVMzS1VyVGN2RThFNFJzMDZHMUJ0UkNHSXl0YUdvRFQ3UGdaRndpU9IBhgFBVV95cUxOX0RqRlhpUXZ5UmhHeEY3Rm51VDZUejdmNXV3UTV1STdHUE1Ca2xfXzJaOUpYMXIyc251RFA0REtSTV9YMENoZTRMRmVFMHMxUm9pelZHdG5oaTlzbldZZzRTN0I1UXp3bmJfX0VBUHhJVGJac1BQNEhXZ0VndVE5VGFvYWI1QQ?oc=5,Cosan (CSAN3) vira a página no apagar das luzes de 2025 suno.com.br,positivo,resultado_guidance,1,Cosan (CSAN3) apresenta desenvolvimento positivo no encerramento de 2025. Notícia indica mudança de página pela empresa sem fornecer dados quantitativos específicos.
Cosan,CSAN3,2026-03-10T07:00:00+00:00,Google News,noticia,"Cosan (CSAN3), Direcional (DIRR3), BRB (BSLI3) e mais: Veja os destaques das empresas - Valor Investe",https://news.google.com/rss/articles/CBMi-AFBVV95cUxQMDVvUk5iRnZZRTQ0OUxVc3NuM2xVQWdBMnVMdk9TMmN0SXktWkQwVHQzbGRaaDJVWnRCTzBreXVuYkItM3RvTXIteXl2X2xuWG9XTnQ0OUowMllsLUpral9SekRlTFcwbjdFZWJya21lOHdGQTFNZkY1RHBERG14T3lERmJmaXcwaTR3cnNvWFRMQTB0MHRyS2h5OXFGbzZKSnhMbFI2RXVUaEU2RnowLU5WZDkxZGI5emFacGhzd1RCVVVSRGRIcXl3dWF6S0dmd0VaS0h3TW9ibElRSkdOVS00MnVTczI1b1c5NGdtYUd3ZWVFVk14aNIBhwJBVV95cUxPY2NreVdfZHRtWVdrUGVTZkdTN05EWnh5NFVmVC1BZjBzYnBRM1BkS29TZDFvS01Wck1MN0I0TWRweTZGaFlRdjdjSlRNbnNhSzVCU3NrRUN1NjFYY0g5cl9IRHlOOFAxQ0FWVWQ0Q21wSmRpSmsxbDlTaGNubm9fa3pwaldmQTVqTFQzSjdtM2Y0X3JzVXFIOThZNGxOaDlXemFaZVhpT3BKTmh0TjliNzFzWWo1LWY2NnM1bzhhRlpqa1B5X3pCaVMwWTAzcjZ2YUs0M3VBaFpKNVNKQ25hUlhSanRZazBvbG1NbzBhcWhjcERVdHVwZVdXRWh6Y1RDcW55cnAwTQ?oc=5,"Cosan (CSAN3), Direcional (DIRR3), BRB (BSLI3) e mais: Veja os destaques das empresas Valor Investe",neutro,resultado_guidance,1,"Matéria de destaque sobre empresas (Cosan, Direcional e BRB) publicada pelo Valor Investe. O trecho não contém dados concretos, valores ou informações específicas sobre os destaques dessas companhias."
Cosan,CSAN3,2026-03-10T07:00:00+00:00,Google News,noticia,Cosan (CSAN3) avança mais de 6% em meio a suposições sobre a venda de ativo - Estadão E-Investidor,https://news.google.com/rss/articles/CBMiqwFBVV95cUxOVS1seml0LWpkb2tLbG9DbnRBSVh4Nnd2Y0djdGtzYTVfLXBBSXhidGdxU0dQSW16UFhKYUpsd3lYQ2VsYVFHcVhkYS15OU9pSUxfNC1mS055anNOaVFSZWJ5LUkxeU05TjNjWVh2akZ6eXV5U2dJajZUM2J1VWNiVm1oM1k2UWloVXhUeVBGaEVuWFBjOW5mX3ZLMUZmeWNqRzNISzNQd0VaUDjSAbABQVVfeXFMT1ZmVG45eDJ6MmtfOVRrTGVHZzJ3Rk9DUVlkdGFFakZvWDNiZ1dBUXNqdHVwZ3hldlFaT2w2a0pTcTFJanRIODJTaEFkYThUMExHUjZoZWtMYzRWZHRwQ0gtbl9URHpTRkpEaC1KY19YU2cxRHltMVZPbVBOM0gyYTRHQk55dmMtSHUxOHlsa291VVRvZklXNUQ2cWJCUjVqYTlOM2RGR3BoT21rMERKaUk?oc=5,Cosan (CSAN3) avança mais de 6% em meio a suposições sobre a venda de ativo Estadão E-Investidor,positivo,m&a_estrategia,1,Ações da Cosan (CSAN3) avançam mais de 6% em meio a especulações sobre a venda de um ativo da companhia.
Cosan,CSAN3,2026-03-06T08:00:00+00:00,Google News,noticia,Alerta de IPO na B3: Cosan (CSAN3) avança com a oferta da Compass - Investidor10,https://news.google.com/rss/articles/CBMiqwFBVV95cUxOWTUzQkstYnI5emRrWmlndUlGSDRPeWNHTXEwUEVsdWdRQ25HQVBCRm43WVBwbnhJUnV1amduOE5FUjF3Rk1UeXlKem1HcmN6QTg1QU0zTlFrWW5RQ1VqX3liRUNYc00zR18yRGJZRmNfMGdIS0lQZExwWUdkV2Z0djQwWUx6SjAyQTRGakhQRjZkVXkyRUFHRm9Uc09YZi1vUEF6RVhtdlo5b0XSAbABQVVfeXFMUGg2b2NmMGpkWU82d0xPUkNNSUNJYlc4VzlhS25ZdzlVdVNpV3VjR3lyUjJkQmpBNjg0b0NNelRJSXhaUjlWMmJUeU81MUxqUGFYb25EemdySnpuWHpCb1g4UmtYcXBINUt4VUlZRUZTckF4V18wZ08wVjI2dVJjRDRPSkFZSk56dm82cFA2bUxNeVYzekU2OTdSdm54aW5TQU1XVnp2VlRCQlFmdVg2SGg?oc=5,Alerta de IPO na B3: Cosan (CSAN3) avança com a oferta da Compass Investidor10,positivo,m&a_estrategia;liquidez_refinanciamento,2,A Cosan avança com a oferta pública inicial (IPO) da Compass na B3. O movimento representa uma ação de desinvestimento estratégico e potencial geração de liquidez para a controladora.
Cosan,CSAN3,2026-01-15T08:00:00+00:00,Google News,noticia,"Cosan (CSAN3): após ano para esquecer, 2026 será melhor? Analistas acreditam que sim - InfoMoney",https://news.google.com/rss/articles/CBMiugFBVV95cUxQQ0dpNGN0OGVmeUxlRUh6QWVrRHZXc2w3dkdfS2dmb2dndjJCb21UWVo0ejh1NEtFbWJGbEVYR21mTEZtaklkN2c5c3ZDTXp2OTN6ZGU2WE83N2NHOU53YWhBeXBpcFFvbWpQRF9hc2pCWkpXYUhvRHZMVnFka0todDF3MWJmVy1SNW44cjhvWlkyRUJPOFVWb1B5dUJZYVdVT2NzNHg5cVlIWVdoSl9LVFBpYjlKWTRnOVHSAb8BQVVfeXFMUDhRRXRDZW9NejZFOFdVaXdJNTJvRThKaXFJcnlER01Eb1FORlNVb05LRmYwZUh5U2J0Zng5VmVwTkF0T3lFRVI5bzhVckZBS2N6V3NoX2c1LXptaVNEXzNvemFaUVBHZXZvSXlDRDQzSlN0V0ZKLWx3cUcydDh3R2NES2M0UWhUN05KZG40OU9YRGpkS3dHZjZELTNHNWlSNzZTYjd6Rl9MMDFYdl9welJxQTZFdFhDdG0tamdqWDg?oc=5,"Cosan (CSAN3): após ano para esquecer, 2026 será melhor? Analistas acreditam que sim InfoMoney",positivo,resultado_guidance,2,"Analistas projetam melhora nos resultados da Cosan (CSAN3) para 2026 após desempenho fraco em 2025, indicando expectativas de recuperação para o próximo ano."
Cosan,CSAN3,2025-12-23T08:00:00+00:00,Google News,noticia,Virada de jogo para a Cosan (CSAN3)? BTG vê espaço para ação dobrar de valor; entenda os motivos - Seu Dinheiro,https://news.google.com/rss/articles/CBMi1wFBVV95cUxNZTNxMFhPd3kyVzNlWndEU0hVOXcxNzlCVU4wbl9QSzRKcGUxaUdqWnRneDVLWU0xbDc3U1czQld3WE02Q2d4TmJlV1dQVFFTS3AxY044WlIzRkh6cG1GOHNnWG1aVHpPeV9CNE11b241T1dKakFyR21EZk1fTlNIZ3RJOEZGZmN6aFM0MkpxZUhOV3k5UmtWZjFfY1pVZi1sdUNpOXVXVVNsNWhzSm12TEN2NklhcWVJV2d0T201Z3dPdzRkMVFBemoyMXZxdXljZkVPa1dZWQ?oc=5,Virada de jogo para a Cosan (CSAN3)? BTG vê espaço para ação dobrar de valor; entenda os motivos Seu Dinheiro,positivo,m&a_estrategia,2,"BTG Pactual identifica potencial de duplicação do valor da ação da Cosan (CSAN3), sugerindo uma possível transformação estratégica para a empresa."
Cosan,CSAN3,2025-12-17T08:00:00+00:00,Google News,noticia,Por que as ações da Cosan (CSAN3) estão caindo mais de 3%? - suno.com.br,https://news.google.com/rss/articles/CBMijwFBVV95cUxQWHh4dnJBOHZhMkU4Q0dnSmJvai0ydk5wNndNMmlNdGhRZDBuRldEdzZiRHdoQTdmLThRa0lMNmhVOWVfTEZyRXpVU0U2OFc3b2Raak9qRmlHQmxyUDBIOG04ZVVKemMyTFZmQUdFM1d2M1lNM3ZvV09RNVBDMmdNUk5jVl91WGFtSWtUWURTNNIBlAFBVV95cUxPY2M5LVR0T0VKcm9kM0RZeldZVy05MExzX3lmcUcwYzhGcFE1WXRweXFFTWVoT3B5Q1ZlR3U5SnU5MU9WV1dEYS1oSGtwRkczUkFzemhzNXN5dFMwSnNmZ3BYR2p1X0k1NVAyMnVVelEtbTFGUF9lOExtLTRsN1lxd0gwUlUyMGV1TDdOdEl6R1JPRGp0?oc=5,Por que as ações da Cosan (CSAN3) estão caindo mais de 3%? suno.com.br,negativo,setor_macro,1,Ações da Cosan (CSAN3) registram queda de mais de 3%. Notícia apresenta apenas o fato da desvalorização sem detalhes sobre as causas subjacentes.
Cosan,CSAN3,2026-03-04T08:00:00+00:00,Google News,noticia,Cosan (CSAN3); Raízen (RAIZ4); RD Saúde (RADL3): veja os destaques das empresas - Valor Investe,https://news.google.com/rss/articles/CBMi8AFBVV95cUxQQ2V3dnpueUdGdjBqWnVySTRJUHM5X0hmOXBZcGVSanItVEZPWmZhaFdzVDFOWHdKTS1ERnM3N0oyTWIycW90X1JRbDl0aTBudjVfaE9hVXpRZGs2SXpETHA5YWR0SnBQTmQxb244b3JNcERwMElQSk5lbmhFUHg0Ul9FVnpVWmVYMWFIWVBLdDNUQlNjN2ZleDd1VWRqQTRNRF83bl9Ga3M3WUJHY0xsZ29lVlJZRE1UbkRmMm4xWFUtQmFHeXhyZHcxeWZUNVNsTEk0STNYMjFPdHR3NVZwMmxtZ01XZHRTUzBYNGcwdjfSAf8BQVVfeXFMT0JyLUFCZnVlWF8wVFpkYlFTcFVnWksxUXdMazJuc0FBUTdLdWVHU0w5ZV9LbWh5eGRxdjQ5TzU5dEhjX0dWNUNOalJWZExRZ1hEVGdtQVVkczRyblpQLUVDMXlBQlVuLWJ3Smh1MURlZWd6ZHdxNFZtNk5FQ3NhaVpTaUdOY1dLZ3M5WWYtZ3d0QnlXTlZVVzZjM1dlbTR1cTRpcWdlY0RKWkQ0aUdvQkRxSExtckZaQXYxVDlWRDRtRS1VSGVSOHpJZlhQZWdOTDViSjJxcmFsU0h4Mk1PT1hxRFJ4TmJqSzRmcW9KZE9mNjVibnd3NjYwTUsyYlJN?oc=5,Cosan (CSAN3); Raízen (RAIZ4); RD Saúde (RADL3): veja os destaques das empresas Valor Investe,neutro,resultado_guidance,1,"Matéria apresenta destaques das empresas Cosan (CSAN3), Raízen (RAIZ4) e RD Saúde (RADL3). O texto fornecido não contém informações específicas sobre os destaques mencionados."
Cosan,CSAN3,2026-03-10T07:00:00+00:00,Google News,noticia,"Cosan (CSAN3) reduz prejuízo para R$ 5,8 bilhões no 4º trimestre - InfoMoney",https://news.google.com/rss/articles/CBMiiwFBVV95cUxNV2RqU1c0bGxPcXQwblAxbFBlTkNtZU5oZXlnMFY3UFRyZldrX2tmeDhsNXpOZ2lzTzNTUnFtSHd4amVfWmNwclg5bm1QRGhUcUNSZkFjZ2UzaTA2R1NkdUFIQ05aRVFQYWo0d0F0cFgxajVJcjNRZ0czal95M3RsNGtFNE1uNFU3bTA40gGQAUFVX3lxTE43Y0ozc1FNUHIwSXFTRnpnQXN0SWctY3RycnNlcVBWRjQ0Vm1rbUFHdXgxTnhMSWRHRUR1aE0yZ1p0YXgwRkJxLTdfbmplNjNRYklycHpMaTdjcXBuaVNlZ3k1SzVhN0xwVkZkeVZpRWJqQmFoUnBNUWtZQ2VsQllzNWVhYmpqTjMtNDZMVmFocA?oc=5,"Cosan (CSAN3) reduz prejuízo para R$ 5,8 bilhões no 4º trimestre InfoMoney",positivo,resultado_guidance,2,"Cosan reduziu seu prejuízo para R$ 5,8 bilhões no 4º trimestre, demonstrando melhoria em relação ao período anterior. A redução do prejuízo indica recuperação parcial nos resultados da empresa."
Cosan,CSAN3,2026-03-06T08:00:00+00:00,Google News,noticia,"Cosan (CSAN3) pede registro para IPO da Compass, em meio à crise na Raízen (RAIZ4) - Seu Dinheiro",https://news.google.com/rss/articles/CBMiwgFBVV95cUxNWThYRFZhUHJqbllxQWVrRnpGQ3ZiTFRHLXR1LU93a2xkRGx1aE9WZVRkdlgtN2YzdGNtTmRaNzFWaEtOcmoycW51Y3hCcVROMXd2b3F1eWZNUVdoX2dFR3djdU04c295M01MR3F5ejl2bUhnb1R5S3Y3R3dTWERuUVo3eDZiYWFVQ25wUDhHMlM0TUVuSHVKRkYxQU1PVnlqY1pKenpTcF9QQ1d4OFhKWHRLeEtPRkpqbTVNM2FNZUVOUQ?oc=5,"Cosan (CSAN3) pede registro para IPO da Compass, em meio à crise na Raízen (RAIZ4) Seu Dinheiro",neutro,m&a_estrategia;liquidez_refinanciamento,2,Cosan solicita registro para IPO da Compass em contexto de dificuldades na Raízen. O movimento representa operação de desinvestimento e busca de liquidez pelo grupo.
Cosan,CSAN3,2026-03-10T07:00:00+00:00,Google News,noticia,Cosan (CSAN3): ação sobe mais de 6% após resultado com redução de prejuízo no 4º tri - InfoMoney,https://news.google.com/rss/articles/CBMinwFBVV95cUxQV2tjdVB4U3NPMDIwell0bF9WeUZfek93SGxzN195MWdPRFNsUkU2aXU1THVqVVZDbl90dmNxb3Z2NXM2OFN1OVVXaUxncG9GRnoyclRTSy1JNFFRN0M4YjNFbl9tZGNaZ2FIMERfb2JxcVNhWkdOT2lnZkF6dnc2ZVQ5NVRZOGRscXZxR21iekVQTl9tbWRpY21oYXg0S2fSAaQBQVVfeXFMUGM3dXI5Q2h3Yjh5ZU5hcEs1NlZYb0hCQXp5MGxnaGt4N01WdmZqM3BCQ1FMdGRFYnY2WXdrWmhFQXQ1TEJLVktZM1FWSVp3MlNxSzhyem1OWl9weUJhaFRXdXNBX2NKUU02czBIdVY5SmliMmV5Y21oZ2IwUzdVeEk0RzRIT0ZqNExFVUVoVnhXRHNlX1BDZXJ6dFdmcXNFTFA0Y2g?oc=5,Cosan (CSAN3): ação sobe mais de 6% após resultado com redução de prejuízo no 4º tri InfoMoney,positivo,resultado_guidance,2,Ação da Cosan (CSAN3) subiu mais de 6% após divulgação de resultado do 4º trimestre com redução de prejuízo. A melhora nos resultados financeiros impulsionou a valorização da ação.
Cosan,CSAN3,2025-10-22T07:00:00+00:00,Google News,noticia,"XP reduz preço-alvo para ações da Cosan (CSAN3), mas mantém compra; veja os motivos - InfoMoney",https://news.google.com/rss/articles/CBMiugFBVV95cUxOT2NnSFd3b3Vtc0RNcUVPTFpmT3VNcXRnSi1jSGRpNktSeFhxZTZHOUMwUE9oRjEzVmxDaHJ0SXQ1MVktSXh3QnRKZWFpTlZyc0ptSmptMm82eUNEX0prQ0pxblVRa2tkNTh6R25hTEtXWHVPQUh1elM2VFFrY1RZMTNXamxNQVpNTW9tYmJGYjNVODdNRmN0YkpfVGx4N2RIVEc1WVR2RG1vUzdOY01wX3FNalBTWmFHb1HSAb8BQVVfeXFMT1k2YWJ2dUZlclhOaUdIWGI2LXFLblJCQUoxOW9BTnhkeWZuNWc1V1hLclVadjJFbUI4NTMzdnlLN0k0dVhyQjM3M3FGVVJVQ3B2a0dfSDNlVmdKcXg2bVZGRWJmM1M3NmZMVnJnd3l5aWhSWlZhQk5raG0ydndPSndEczhHV25xT0V1U0NubWVGaWxhclFTQXViNUhMLTFIYXJsQ09XT1AweGJ6QUY4Y0NIS3JabVNMSTNJUmlDQ00?oc=5,"XP reduz preço-alvo para ações da Cosan (CSAN3), mas mantém compra; veja os motivos InfoMoney",positivo,resultado_guidance,2,"XP reduz preço-alvo para ações da Cosan (CSAN3), mas mantém recomendação de compra. A análise indica confiança na empresa apesar do ajuste na projeção de valor."
Cosan,CSAN3,2025-11-04T08:00:00+00:00,Google News,noticia,"Cosan (CSAN3) levanta R$ 9,062 bi com oferta de ações e anuncia nova operação - InfoMoney",https://news.google.com/rss/articles/CBMisgFBVV95cUxPdE9tMDlQekNQLWhmdE1oVUloRkwwWFpycFB4UXZqTTFsVVBfYXg4YmdIN19VeHd1UzM4UlUzNDR1bjRfclZ5MGxHMGFKbWhfOUMxTzkyRUpOYkZKNGtvMEhwRkpfejhrZXh4S2dzcmM0NlFVYzRLVGg1ZlZHc0c0TzBEeW16M194RTMtVDVtQmFNd25YaGhNOFlGaDRpaTZOOHQ3dFRMNVJlLTRXRkdOMDJB0gG3AUFVX3lxTFBmdF9QN3ZjVWN0UFBqMlpDaDFRUktvcldESnROYU5TdFktSUF0aE1wUzRJYzRYVGNCbEU2STA3ckVFaERMbWRaTy1TQ3lveFR3bG9JUDZsSjN0N29IbnBUbzBRMTlCY0Nydmhxb2hCU0t6RzZCRVVWOUlKQWR2VS1aUEdJT3JmME80MjI5QmdyTTkwQ1Y1RGZtblR5RkRreXF6TExNVjk5RGRIN3ZYNEhSa2xNbU1Law?oc=5,"Cosan (CSAN3) levanta R$ 9,062 bi com oferta de ações e anuncia nova operação InfoMoney",positivo,liquidez_refinanciamento;m&a_estrategia,2,"Cosan levantou R$ 9,062 bilhões através de oferta de ações e anunciou uma nova operação, fortalecendo sua posição de liquidez."
Cosan,CSAN3,2025-12-16T08:00:00+00:00,Google News,noticia,Cosan (CSAN3) e Rumo (RAIL3): ações fecham entre maiores quedas do Ibovespa na sessão - InfoMoney,https://news.google.com/rss/articles/CBMiugFBVV95cUxOOGE0MUdqOGIyMmx5RnV3T2NPaEFCVDkwdW9URDFlWDd6dmtHODlRSXBuV19faWlNVmNvNzlJMFd3MnNQNGdNdFJUNThNYzBnSERHV0xmQjFZWnczZ1lJVWFOLXhRVlduN3Y1TzR3TG90SEFsWVZYYjVuOURhUFhMSEJYWVZkcUc4ZVRkMG4xbTlBQm4tbTZlRVlua0twSDNGdkJEY1BMR1AxdHhqM3lUSS1nazBfaHU0SGfSAb8BQVVfeXFMUGlVUHV1OXM3aFlBeEpVak5DaVk5Y1FHQVI0eTJ1cDl3eUNDTFZSUVpmNjlJY1F0NDN3ZlBzbjk4RXNvcVVPV3A3ZWhITjRHWm9GcDlKYVRVc2gtc1BHQmxTNzhueGd3eEhFdWlVZGh4aVV1SFItcEhBY0NtQXNiSm54Ry14S3RzMVhDRXNFSjd0TlZKcFRwMXRPcG4tWmlfQkszR3RLT1BpSlhGVmZqTEQtSkxzMEdsYldrOGtZT0U?oc=5,Cosan (CSAN3) e Rumo (RAIL3): ações fecham entre maiores quedas do Ibovespa na sessão InfoMoney,negativo,setor_macro,1,"Cosan (CSAN3) e Rumo (RAIL3) fecharam entre as maiores quedas do Ibovespa na sessão de pregão analisada. A notícia relata apenas o movimento de desvalorização das ações, sem fornecer dados quantitativos de percentual ou motivos específicos."
Cosan,CSAN3,2026-01-15T08:00:00+00:00,Google News,noticia,"Cosan (CSAN3) desponta como aposta de longo prazo de bancões, mas derrapa na B3 - Investidor10",https://news.google.com/rss/articles/CBMivgFBVV95cUxQcXFWdTB2ejBEWXRPZ2pMTy1GT2tncU5yOXZUS2ZIVUdUX3FtempNb2JIT1ZrSjk1a0w4ZHRIMnVYWXVZRmtKaUJGaDNGVFJDbVN2ZzJpRDg3UDhONWdCVXJLLXdsZkppY0lnb3FyQUctREtiTTBtRldfZ3VmcUJxY1c5ZjZQeXBXdExKZFY2MHhoN05SR0V6bHZUX1M5bjA1dThQc1hnQXhNc0ZFMndIRE10c0w0dXJKcFkzbGtR0gHDAUFVX3lxTFBieFUzUVRYeWhzQmUxY0VZSTJyZ3NNRGNjTjFBOFR4VXlSdnFxUjRBb3VWWDFZSUt6enVmVlFwTkM3cTg1b3VGVUswTkJmTFdQdFRsTVpHa1JRLWlRQ3NWREpjVzQxdGVWX0M4aDk1QzZFTG5DX2ktRXAteThUak9aUEJaeGZubl9GR29xLUZnNXM5RXdLc1pIcWtva1hoZU9WdnloWkJKaVRKTHBxLWxHaXVpZDJHS0ZzUG1ESVJ0d1JVZw?oc=5,"Cosan (CSAN3) desponta como aposta de longo prazo de bancões, mas derrapa na B3 Investidor10",negativo,setor_macro,2,"Cosan (CSAN3) é considerada aposta de longo prazo por grandes bancos, porém apresenta desempenho negativo na B3."
Cosan,CSAN3,2025-11-12T08:00:00+00:00,Google News,noticia,"Cosan (CSAN3) levanta R$ 1,43 bilhão em segunda oferta de ações - InfoMoney",https://news.google.com/rss/articles/CBMinwFBVV95cUxORmlYYWs0N0ZHVklHQnhjRlNOUFgyaG4xeEd6Mmx2WG9RZUZOTzR6N2hiOVdQdzFkQzJsR3dIaTQ5UWJIaXRldkZUY212X000c2pfc211WmNxNTdScGF3OC1ZYUd2dTJvWFc5TGp4M3N2dlI0WnpjcXJYV3RGLW9mWnZFVjdBQXpkemszZ096dTBhSmlzbmg1bE5EcHJXbDTSAaQBQVVfeXFMTkJ3aDZHR1A2d1JIT3dMMDZGUzBNNGVQQVJrQWItWUtSR0xidFpOdFNveS11V29IV0tpblJFd0xFZTZqM2dna0J5b3lRdUkwaG5Qd2R6NWxGT3k1SFBYRmxXZTZ3MVBwZnFrOGphNktDZm0yaDJaQWxGajhDb2tBX2VNWk00T2RDbVVNSUhYdDcxbmNCSzNlVTk5cTg5WFhfZkhVTF8?oc=5,"Cosan (CSAN3) levanta R$ 1,43 bilhão em segunda oferta de ações InfoMoney",positivo,liquidez_refinanciamento;m&a_estrategia,2,"Cosan realizou segunda oferta de ações e captou R$ 1,43 bilhão. A operação reforça a liquidez e capacidade de financiamento da empresa."
Cosan,CSAN3,2026-02-13T08:00:00+00:00,Google News,noticia,S&P revisa notas de crédito de Cosan (CSAN3) e Rumo (RAIL3) para negativas - Valor Investe,https://news.google.com/rss/articles/CBMi4gFBVV95cUxOTDctbVNBVngybGxtODhDWmI5WjF1a1piYy1IcWJQUHptNWx2ZkZRUmJ6V0pNSzRWekFPVFAyTnJ0MlNTRlBkREtDZ0JWdFNHQUNRMUp5Rk0tUXBjeXZuc1pGTEFBTWx5OTNudFRrYmlIUEVHSFpaY0NDcE9obU5MdWNzdlFueE9jdUJMTHhDbEIybzFCWHZOTWJCWDBEbXh0ZlB1S1kyTEkxQnNtbTdhTUxoVWo4TkhteGp1bzRtSkJWWHh1dUdvWmIwODc0cjJLZDJyYUtISmhVZ3FmWHh1SVRn0gHwAUFVX3lxTE9heGx4Tnh1MzFhYkt0NldRMENZaG14LVpJTFdFRzZGM0UzTDZaMVlFWm5aTmVRdmdiRHpYYzlVNkJUOVRlRV9EaFB5RUZVdXFBdVNBb2pEWnBGQmFLYlZiODZacS1JVUVMVmVBUTVadFhEcDF2NHgyY1dlMnppVFJEVVlvUVFPbVVKQlNUNlNyZ3Z5Nm0xWnFiWks4U0MtZzRNdTFENGNjWG5ES3J1V3hqMjN6Y2MtU01lWGNFcE80d2x3bDVpUGZ5V0MzQ0MxZjZvOHlOWGtvbnZhblI4U1Y0N1dxZFpHN3ZUU1dza2NvOA?oc=5,S&P revisa notas de crédito de Cosan (CSAN3) e Rumo (RAIL3) para negativas Valor Investe,negativo,liquidez_refinanciamento,3,"A S&P revisou as notas de crédito de Cosan (CSAN3) e Rumo (RAIL3) para negativas, sinalizando deterioração na avaliação de risco de crédito das duas empresas."
Cosan,CSAN3,2026-01-20T08:00:00+00:00,Google News,noticia,Cosan (CSAN3) pagará R$ 83 por título de renda fixa; saiba quem recebe - Investidor10,https://news.google.com/rss/articles/CBMisAFBVV95cUxOUGVrejVBd2pmaTBaNXhtUTVUWU05TnFEbENieXpsdkF1QVNfaE1mOHBuTnRtamNGQk9ka09kYXlobXlzTnRpSFdyM2QweXVJVFQwa3BuN2xUQ0lSN3k5YnRKd0pRLU9ldjhZbHU2b0phMmFHd3J3c3BSa1ZvLTdtbFdvaWZaZWRhd09yMTV2WkhTN1F0V3Yza0h4SnZMMFJTUEsyV0FQeVotWlRKYVI4QdIBtgFBVV95cUxNX2FxdWk4V2JUakc1cC1WMVBoQklqT1dEQlJfSm1oSmI0ZmpZOWJYaFNFazRObmxIZFMtb2x0aC1ULUZQd05UcXQ2TVBleEwtWGd1ZlZSMEMxX1I1QVUzUEtSRVlZUU5kbDZkZkkzd0h2bVItblBsUTROVWQ5cWhDYXBsdGxOVWdHQ2NScXQwWjZkaUVzSW1DOEpSellDT3dJbDZ2QlIyZFJuOVo1Y1VRX0FDYnJvUQ?oc=5,Cosan (CSAN3) pagará R$ 83 por título de renda fixa; saiba quem recebe Investidor10,neutro,liquidez_refinanciamento,1,Cosan pagará R$ 83 por título de renda fixa. Trata-se de um evento de pagamento ordinário de títulos de dívida da empresa.
Cosan,CSAN3,2025-11-04T08:00:00+00:00,Google News,noticia,Cosan (CSAN3) prevê suporte à Raízen (RAIZ4) em nova oferta de ações - Investidor10,https://news.google.com/rss/articles/CBMirgFBVV95cUxOUWdoRmZObVJQMjVld0Mwcms4bXctelBSbndZNmZycDVVQnV2MThxZ1lVZnlXdVBpQ1I3RXlRR2NoOVdGSHRGUlF2S0ktbjFud3N6OE4tT3lwU0tFVGNpOEFoNXJ0Z1VXdDF6XzVHc0J4YjZkMFFDV0NuNWw0RWE2TV9GbVp0cGNmZldiR0hEMGV5dlZOVVFNdVlYRmozbWZFeFRidDhLUEJuT2Q1U2fSAbMBQVVfeXFMTlBzd1QxYlhZWV9GbGM5ZEhHcUctTFdlaVQ0ZWo1T1hEWF9BeExCLTdaeTA0eC1HT2I0dWdEaVdxMUhqTGN1UnRRMkk1SzlESGVfYUJrXzZLdjM2bjRLX2pUUDM0Q1ZUYU5BZlVJY0tLQWpQeURlRExfbG51aTNvVTNfUk1kcmpUdGM2R0VTSFhuNUtsckNOQi1FYjdHZHNoS09PUlBCWjZCbEo1UnE2aW03ekU?oc=5,Cosan (CSAN3) prevê suporte à Raízen (RAIZ4) em nova oferta de ações Investidor10,positivo,m&a_estrategia;liquidez_refinanciamento,2,Cosan prevê fornecer suporte à Raízen em uma nova oferta de ações. A ação representa movimento estratégico de reforço de capital na empresa.
